Blog Item Title,Schedule post date,Blog Full Text,Blog Category,Blog Authors
Pittlandia: Is Pittsburgh the New Portland?,12/22/2016,"<p>We've all seen the articles. They have titles like, ""Pittsburgh: The New Portland"" or ""Portland is Over: All the Cool Kids are Moving to Pittsburgh."" So, is it true?</p><p>Pittsburgh and Portland are constantly being compared as the numbers of microbreweries and organic food markets in each increase, while they were once primarily known for industrial pasts. But in my humble opinion, the articles miss a crucial factor: <strong>how do they compare in terms of their respective environmental agendas?</strong></p><p>As a native Pittsburgher who recently visited Portland for the first time, and with my current position at PennFuture, I could not help but compare the two through my own research and first-hand observations.<br /><br /> Let's start by comparing air quality. The American Lung Association's 2016 State of the Air Report shows the following:</p><p><strong> High Ozone Days Particle Pollution Total Population at Risk<br /> Pittsburgh </strong>F F 1,231,255<br /><strong>Portland </strong>B C 776,712</p><p>This chart is very representative of what I experience on a day-to-day basis in Pittsburgh and also represents what I experienced on my week-long vacation in Portland. With high asthma rates, it's no surprise Pittsburgh ranks in the dirtiest 15 percent of U.S. cities, while Portland is in the 78.7 percent of the cleanest cities. Spending a day hiking in Eagle Creek, Oregon was such a unique experience due to that fresh, clean air-something that people all over the United States should not have to travel 2,500 miles to experience.</p><p>So, why is our air not as clean? While Portland has taken a proactive stance on developing sustainable urban design and combatting climate change, Pittsburgh is just starting to follow suit. Here are some examples:</p><h2>Bicycling</h2><p>Portland is a founding member of the Cities for Cycling initiative, which includes traffic engineers and planners from some of the best bicycling cities sharing information and developing a national urban bicycle design guide. According to its 2030 plan, the group hopes to implement an expansion of intersection bike boxes, improve signal infrastructure by installing bicycle detection in bicycle lanes, and consistently improve bike lanes. The city has also provided bicycle parking in commercial areas known as ""bicycle corrals.""</p><p>Perhaps the most fascinating part of my trip occurred as my friend and I walked downtown, where we witnessed nearly every car yield to pedestrians and bicyclists due to the Oregon Pedestrian right-of-way laws. It really was like a Portlandia episode.</p><p>Pittsburgh has a few more hurdles when it comes to biking. We have a more drastic winter season (as opposed to Portland's two seasons: dry or wet) and a lot more hills. However, despite these setbacks, the bike scene is really picking up due to advocacy groups like Bike Pgh! With the group's hard work, Pittsburgh City Council recently approved the Mayor's Complete Streets Policy, which states, ""Everybody, regardless of who they are, where they live, or how they get around, should have the choice to travel in a safe and convenient manner.""</p><p>In addition to this ordinance, Pittsburgh now has 50 Healthy Ride bike stations, released a report on pedestrian and bicycling safety in Pittsburgh, and teaches nearly 1,500 youth and adults on safe riding skills.</p><h2>Climate Action Plan</h2><p>The City of Pittsburgh, using the Portland model, is currently looking into identifying two to three neighborhoods to serve as Pittsburgh pilots that have high cycling activity, in which they can install bike racks in strategically identified parking spots and monitor the effectiveness of the program as part of the Pittsburgh Climate Action Plan.</p><p>The Pittsburgh Climate Action Plan outlines the measures that government, businesses, higher education institutions, and citizens of the City of Pittsburgh have begun and can continue to undertake to help mitigate the local effects of global climate change. It's created by the Pittsburgh Climate Initiative, which is a collaborative involving city and county government, non-profits (like PennFuture), higher education, and the business community.</p><p>As we enter 2017, the third edition of the Climate Action Plan will be released, with Portland's Climate Action Plan as its chief model. For example, in Portland, there is a ""FAR Bonus Program"" that offers a Floor Area Ratio Bonus in its building code.</p><p>With this program, developers may build an extra 3 feet x 2 per foot of green roof they construct without obtaining additional permits. There is also a reimbursement of up to $5 per square foot on green roofs, because they are storm water-reducing infrastructure.</p><p>Pittsburgh plans to use this strategy by building off of the existing URA Pittsburgh Home Rehabilitation Program loan program for low-income households, exploring clean energy bonds through the Federal government, establishing a pilot limited to a certain number of homes and businesses, and communicating results with private lending institutions to encourage energy efficiency financing options. This is just one of many examples of how Pittsburgh could follow Portland's footsteps on climate change.</p><p><strong>We know this kind of change can happen, even in a city like Pittsburgh. </strong>For instance, this past October, Pittsburgh became the 17th city to adopt a legislated building benchmarking ordinance that requires commercial buildings 50,000 square feet and over to disclose energy and water usage in order to reduce energy costs and carbon emissions.</p><p>Although this was also modeled after Portland's energy benchmarking policy that is a little more ambitious (requiring commercial buildings 20,000 square feet and over), Pittsburgh is using Portland as its model to continuously work to become a better, greener Pittsburgh.</p><p><strong>With this in mind, we can hopefully have a cleaner, healthier future in store.</strong></p>",Climate; Energy; Environment,"Annie Regan, Senior Program Manager"
Restoring the Loyalsock State Forest After the Flood,12/13/2016,"<p><span>In the early hours of October 21, 2016, six to eight inches of rain </span><a href=""http://wnep.com/2016/10/21/schools-delayed-closed-due-to-flooding/""><span>deluged a narrow band</span></a><span> of north central Pennsylvania. This torrential downpour created an enormous overflow of surging water that carried boulders, trees, and tons of dirt downstream through an area that included portions of the </span><a href=""http://www.dcnr.state.pa.us/forestry/stateforests/loyalsock/""><span>Loyalsock State Forest</span></a><span> located in Sullivan and Lycoming Counties. </span></p><p><span>The torrent of flood waters and debris deftly washed out roads, bridges, and homes as it rushed downstream through the forest toward the Loyalsock Creek and eventually the Susquehanna River. Residents in its path either quickly evacuated their homes or were rescued by emergency personnel. Some families </span><a href=""http://wnep.com/2016/10/21/homes-washed-away-by-flooding-in-sullivan-county/""><span>lost everything</span></a><span>.</span></p><p><span>Downstream from the Loyalsock State Forest, an eight-inch pipeline operated by Sunoco Logistics </span><a href=""https://stateimpact.npr.org/pennsylvania/2016/10/21/sunoco-gas-pipeline-ruptures-in-lycoming-county/""><span>ruptured when struck</span></a><span> by debris from a washed-out bridge over Wallis Run, a tributary of the Loyalsock Creek. This rupture sent over 55,000 gallons of gasoline into the flood-swollen waters of the popular recreational creek. While </span><a href=""http://lancasteronline.com/news/local/gasoline-flowing-south-from-pipeline-spill-in-lycoming-county-should/article_5ed0d20c-97b8-11e6-8fb8-17dc59d3a8e1.html/?alfjlfj""><span>water contamination concerns</span></a><span> by those downstream eventually </span><a href=""https://stateimpact.npr.org/pennsylvania/2016/10/24/officials-say-no-drinking-water-impacted-by-sunoco-pipeline-rupture/""><span>were dismissed</span></a><span>, residents living in the area of the pipeline rupture </span><a href=""https://stateimpact.npr.org/pennsylvania/2016/10/21/sunoco-gas-pipeline-ruptures-in-lycoming-county/""><span>experienced strong fumes</span></a><span> from the spilled gasoline. </span></p><p><span>One area of the flood-damaged Loyalsock State Forest has been under special scrutiny for several years. Since 2013, the </span><a href=""http://www.saveloyalsock.org/""><span>Save the Loyalsock Coalition</span></a><span> has been working to protect a region known as the </span><a href=""https://www.fractracker.org/2013/05/clarence-moore/""><span>Clarence Moore lands</span></a><span>, an area encompassing over 25,000 acres of unbroken forest land currently under threat of natural gas development. Ironically, the Coalition, hosted by </span><a href=""http://www.pennfuture.org/""><span>PennFuture</span></a><span> and comprised of over </span><a href=""http://www.saveloyalsock.org/loyalsock_supporters.shtm""><span>20 member organizations</span></a><span>, sponsored </span><a href=""https://www.flickr.com/photos/101329820@N06/sets/72157673707612240/""><span>a special event</span></a><span> in the now flood-ravaged ghost town of </span><a href=""https://en.wikipedia.org/wiki/Masten,_Pennsylvania""><span>Masten</span></a><span> just a few weeks prior to the flood. </span></p><p><span>In only a few short hours, nature's fury drastically transformed this popular state forest. Damages to the Loyalsock State Forest are estimated at approximately $6 million dollars, with total flood damage in the four affected counties topping over $33 million dollars. Information posted to the </span><a href=""https://www.facebook.com/Loyalsock-State-Forest-259890704135313/?hc_ref=PAGES_TIMELINE&fref=nf""><span>Loyalsock State Forest's Facebook page</span></a><span> and the </span><a href=""http://www.dcnr.state.pa.us/forestry/stateforests/loyalsock/index.htm""><span>DCNR website</span></a><span> reports the locations of closed roads and bridges. Sections of the </span><a href=""http://www.dcnr.state.pa.us/forestry/recreation/hiking/stateforesttrails/oldloggerspath/""><span>Old Loggers Path</span></a><span>, a scenic 27-mile hiking trail, have been washed out and will require reroutes and trail rebuilding. </span></p><p><span>The Loyalsock State Forest is no stranger to flood damage, having </span><a href=""http://www.pennlive.com/midstate/index.ssf/2011/09/two_weeks_after_flooding_from.html""><span>suffered similar destruction</span></a><span> from Tropical Storm Lee in 2011. It took several years to rebuild the bridges and roads that have now been washed away again by October's raging floodwaters. Yet even though some damage to the forest is still under assessment, repair work by DCNR maintenance crews </span><a href=""https://www.facebook.com/permalink.php?story_fbid=423188407805541&id=259890704135313""><span>has already begun</span></a><span> and in time, the trails, roads and bridges will be repaired.</span></p><p><span>Downstream, clean-up efforts continue in flood-damaged communities, and Sunoco Logistics has </span><a href=""http://wnep.com/2016/11/14/gas-pipeline-back-in-operation-after-flood-damage/""><span>repaired the ruptured pipeline</span></a><span>. Small town communities have come together to help their neighbors through fundraising efforts such as spaghetti dinners and penny socials. Welcome news for residents is that </span><a href=""http://paenvironmentdaily.blogspot.com/2016/11/gov-wolf-sba-federal-disaster.html?utm_source=feedburner&utm_medium=email&utm_campaign=Feed%3A+PaEnvironmentDaily+%28PA+Environment+Daily+Blog%29""><span>low interest loans</span></a><span> will be available to help rebuild local homes and businesses damaged by the flood and that </span><a href=""http://www.morning-times.com/state_news/article_f7abfe4f-4796-59e8-af87-3b1e73cfab63.html""><span>federal disaster relief</span></a><span> has been granted to the four counties affected by the flash flooding. </span></p><p><span>The Loyalsock State Forest, a favorite destination for many, is well worth restoring. As the forest's roads and trails are repaired, nature will heal any damage to the forest's diverse flora and fauna. During this restoration process, the Save the Loyalsock Coalition will continue their efforts to preserve forever the wild and natural beauty of the Clarence Moore Lands.</span></p><p><span><em>PennFuture is a founding member of the Save the Loyalsock Coalition and provided the initial outreach to bring together and organize Coalition members. Staff members of PennFuture continue to provide support to the Coalition through their leadership and expertise. The author of this post, Ann Pinca, is a freelance writer who has served as Communications Coordinator for the Coalition since its inception. Like many members of the Save the Loyalsock Coalition, Ms. Pinca enjoys hiking and exploring the Loyalsock and other Pennsylvania state forests to enjoy the peaceful beauty and abundant natural wonders that they contain.</em></span></p><p><em><span>For additional information on the Save the Loyalsock Coalition, visit </span><a href=""http://www.saveloyalsock.org/""><span>www.saveloyalsock.org</span></a><span> or email</span><a href=""mailto:saveloyalsock@gmail.com""><span>saveloyalsock@gmail.com</span></a><span>.</span></em></p>",Community; Environment,"Ann Pinca, Save the Loyalsock Coalition"
My Mission is PennFuture's Mission.,12/7/2016,"<p>After the recent presidential election, I immediately asked myself this question:</p><p><strong>What can I do to have a positive impact during the next four years, when much of what has been accomplished in terms of advancing a clean energy future will be under attack?</strong></p><p>Little did I know, the answer would soon be...</p><p><strong>Become the new Communications Director at PennFuture.</strong></p><p>I could not be more thrilled to join a team of such incredible, intelligent and passionate leaders in the arena of fighting for our environment, advancing clean energy, working on behalf of communities being undermined and destroyed by polluters, and pouring energy into preserving the landscape and beauty of Pennsylvania.</p><p>As we embark on an unforetold journey beginning on January 21, 2017 at the federal level, what I do know is that our state is in good hands when it comes to advocates - like my colleagues and the volunteer leadership at PennFuture - who are working on behalf of the citizens of Pennsylvania. Every citizen deserves clean air to breathe, pure water to drink, and a natural landscape to explore.</p><p>The mission of PennFuture is one that I am personally passionate about and excited to advance as the new Communications Director. I look forward to implementing new initiatives that allow us to expand our reach, deepen our impact, and increase engagement across every county in the state.</p><p><strong>Please feel free to say hello and email me at <a href=""mailto:rex@pennfuture.org"">rex@pennfuture.org</a>. I can't wait to work with you as we further the PennFuture mission during the next four years and beyond.</strong></p>",Climate; Environment,"Stephanie Rex, Director of Communications"
Taking Stock of the 2015-16 Legislative Session </br> Historic Attacks and Lost Opportunities,11/21/2016,"The Pennsylvania General Assembly's two-year session wrapped up with a flurry of last-minute activity, capping off months of historic attacks on environmental priorities. It was a tumultuous session characterized by numerous attempts to weaken environmental regulations, halt progress toward a clean energy economy, and open up more land to natural resource extraction.<br /><br /> PennFuture worked tirelessly to defend the Commonwealth against these attacks and strengthen natural gas drilling regulation, protect endangered species, promote energy conservation, and advance Pennsylvania's opportunity to develop a timely carbon reduction strategy. The fight is not over though. Many of the bills described below are expected to be re-introduced during next session, which begins January 2017.<br /><br /> Nevertheless, here's a rundown of the session's environmental wins, narrow escapes, lost opportunities and losses.<br /><br /><u><strong>Wins</strong></u><ul><li>Defeated attempt to commercialize state park lands (HB 2013). This bill would have advanced efforts to open up state parks to private developers to build hotels, golf courses, amusement parks, commercial and industrial parks and other uses incompatible with our state parks' natural assets. It was soundly defeated in the House.</li><li>Defeated effort to ban municipalities from addressing plastic bag pollution (HB 1280). This last-minute bill would have banned local municipalities from banning of levying fees on plastic bags, which account for a significant portion of water pollution and litter issues. It was soundly defeated in the House.</li></ul><br /><u><strong>Narrow Escapes</strong></u><ul><li>Senate advanced legislation to gut energy efficiency program (SB 850). This legislation was pressed as a commonsense effort to make manufacturing more competitive, but in fact it was a veiled attempt to allow the largest state industries to avoid paying their fair share for energy conservation programs, resulting in far less investment in this cost-effective program. It passed the Senate, but did not receive a vote in the House.</li><li>House and Senate almost broke the state building code process...again (HB 568). This controversial legislation would have locked in a failed process that has disallowed Pennsylvania from adopting modern building codes, include strong energy conservation standards. It passed the Senate, was amended by the House and passed, and amended again and passed by the Senate. The House never took final action.</li><li>Governor vetoes attempt to break state regulatory process (SB 562). This seemingly innocuous bill would have given the legislature the power to indefinitely delay new regulations, potentially killing new proposed environmental safeguards. Both the House and the Senate passed it, but Governor Wolf issued a veto..</li></ul><br /><u><strong>Lost Opportunities</strong></u><ul><li>Bad amendments taint good gas royalty bill (HB 1391). Rep. Everett pushed for good legislation to require gas drillers to pay landowners who lease their land for drilling the full amount they owe in royalty payments, yet numerous amendments aimed at weakening new gas drilling regulations and barring methane regulations set the stage for unnecessary legislative battles around a good bill. It ultimately did not come up for a vote in the House.</li><li>Effort to rollback endangered species protections sinks good government bills (SB 1166 and SB 1168). This pair of bills would have allowed the Fish and Boat and Game Commissions to set license fees and better fund their programs. Unfortunately, amendments were offered in the House that would have weakened protection for endangered species. The bills passed without amendments in the Senate, but did not receive votes in the House.</li></ul><br /><u><strong>Losses</strong></u><ul><li>Creating an environmental regulation hit list (SR 385). Senate Resolution 385 directs the Joint State Government Commission to conduct an unnecessary review of environmental laws and regulations to determine if they are more protective than federal laws. Once identified, the study will provide convenient cover to roll back laws designed to address environmental threats specific to Pennsylvania. It passed overwhelmingly in the Senate (Note, resolutions only have to pass their respective chamber and don't require gubernatorial approval).</li><li>Delaying state planning to reduce carbon pollution (SB 1195). This hotly contested bill implements a convoluted process that all, but guarantees Pennsylvania will wait until the very last minute to submit its plan to reduce carbon pollution by 30% by 2030 under the Clean Power Plan. The bill passed both the House and Senate. Governor Wolf signed it into law.</li><li>Halting new rules for conventional oil and gas drilling (SB 279). After 5 years of public input, legislative input, and policy debate the General Assembly advanced legislation to stop new rules for conventional oil and gas drilling from taking effect. These rules would have set commonsense standards to protect water, communities, and air from a polluting industry that has been working under the same regulations for over 30 years without updating. The bill passed the House and Senate. Governor Wolf signed it into law.</li></ul>",Climate; Community; Energy; Environment,PennFuture
What a Trump presidency means for our environment and future generations.,11/17/2016,"<h3>Whats Next for Pennsylvania?</h3><p>It's the morning after and we are all wondering what is next? It is a very dark place for the environment and I will not try to put varnish on it. President-elect Trump has promised to abolish EPA, to appoint climate deniers to key posts to retreat on environmental regulations, renege on the Paris Accord, and dismantle the efforts to advance clean power and bring back coal. Trump will have the House, Senate and Supreme Court on his side, so with a unified Republican government, his words will not come back empty.<br /><br /> The environment lost the biggest battle imaginable and the worst part of that is these urgent issues were rarely if ever mentioned. Greenland is in full-scale melt, the Arctic is moving to a complete summer melt and the earth is setting record-breaking temperatures now spewing its own carbon dioxide and methane. In the face of this and while watching the rapid expansion of frack gas, pipelines and generation infrastructure, there was not a single environmental or climate question in the debates. The media has utterly failed to address environmental threats.<br /><br /> In the face of Citizen's United, gerrymandering and massive amounts of dark money, the environmental community has largely failed to restructure itself to be able to be actively engage politically to add our voice to the debate. In that vacuum, major donors moved into the state, created their own structures, spent millions creating incompetent and ineffective grassroots while we were left sitting on the sidelines. We must own that and make this moment a turning point.<br /><br /> While Hillary Clinton gave one good speech in Florida and mentioned the climate from time to time, neither candidate really made protecting our environment a pivotal National issue. At the state level, I understand we lost our best friend Representative Leanne Krueger-Braneky and Katie McGinty went down in the most expensive Senatorial election in American history. The process has utterly failed and the majority of American voters have failed our children and their future.<br /><br /> On a personal level it is extremely distressing. Once again, I just shake my head at the enormous mistake that American voters made yesterday as I consider my grandchildren's future. I have been fighting for progress on climate for most of my career and I have experienced repeated legislative failures starting with the BTU tax in 1993. Looking forward and we must do that, we need to be careful not to be Pollyanna or even reassuring. This is kick in the worst place possible and we all need to search within ourselves, within our community and decide how we move forward in the days ahead.<br /><br /> I am reminded of what General U. S. Grant did after a brutal defeat at both Shiloh and at Wilderness. Grant did not retreat, as other Generals urged him to do, instead he attacked. In the face of daunting and almost impossible odds I dust myself off and together we must march forward.<br /><br /> The fight is not over, attack we must.<br /><br /> Larry<br /><br /><br /> Larry J. Schweiger<br /> President and CEO<br /> Citizens for PennFuture</p>",Climate; Community; Energy; Environment,Larry J. Schweiger
