Blog Item Title,Schedule post date,Blog Full Text,Blog Category,Blog Authors
From the CEO: PennFuture Priorities in 2018,12/19/2017,"<p>The PennFuture staff has been reflecting on 2017 as the year comes to an end. Many of us and our supporters tend to view the year as one marked by profound threats &ndash; to our climate system and our children&rsquo;sfutures, to our democracy, and to the institutions and laws that give us some measure of protection from pollution. Indeed, the year was marked by all of that, but also by counterbalances that can end up being similarly profound.</p>

<p>With the president&rsquo;s <a href=""https://pennfuture.org/News-PennFuture-Statement-on-Paris-Climate-Agreement-Withdrawal"">withdrawal of the United States from the Paris Climate Accord</a>, we&rsquo;ve seen the Paris to Pittsburgh movement take shape, culminating in former Vice President Al Gore and the Heinz Endowments&rsquo; hosting of the largest ever Climate Reality Project training in Pittsburgh this past October. As a result, we have hundreds of new climate communicators in our state, ready to deploy and bring solid information about the climate crisis and its solutions to the public.</p>

<p>We have seen the PA State Supreme Court issue a second important opinion in <a href=""https://pennfuture.org/News-State-Supreme-Court-Rules-Leasing-Public-Land-for-Fracking-Betrayed-Governments-Constitutional-Duties""><em>PEDF v. Tom Wolf, Governor and Commonwealth of Pennsylvania</em></a>, building favorable case law around the Environmental Rights Amendment to Pennsylvania&rsquo;s Constitution. And the gerrymandering movement has tremendous momentum.</p>

<p>We&rsquo;ve seen environmental issues influence elections in places like Delaware County and Jessup, where voters turned pro-pipeline and pro-gas elected officials out of office and replaced them with clean energy visionaries.</p>

<p><strong>We are entering 2018 with a wind at our backs. Here is a look at PennFuture&rsquo;s priorities for the coming year:</strong></p>

<p><strong>Clean Energy Cities Initiative</strong><br />
In the wake of the Paris withdrawal, we&rsquo;ve witnessed Pennsylvania communities and elected officials step up by taking pledges and other actions that indicate their seriousness in taking their climate future into their own hands. What comes next for these communities, especially smaller ones that are willing but perhaps lacking the expertise and resources to take the next big step into renewables and energy efficiency? <a href=""https://pennfuture.org/careers-and-internships"">PennFuture is piloting a program in Pittsburgh</a> that we hope to expand to three new communities as support grows. PennFuture will be on the ground in communities, ready to offer technical and planning assistance, help design projects and find resources to move communities aggressively in the new energy space, bypassing the anti-environmental forces and climate deniers trying to hold this unstoppable movement down.</p>

<p><strong>Green in &rsquo;18 Campaign</strong><br />
As part of our new civic engagement program, formed as a result of our January 2017 strategic alliance with Conservation Voters of Pennsylvania, <a href=""https://pennfuture.org/careers-and-internships"">PennFuture will launch its Green in &rsquo;18 campaign.</a> The campaign will elevate the public discussion around environmental issues in the upcoming elections. PennFuture and Conservation Voters of Pennsylvania are working with more than 30 environmental, land, water and recreation groups to design a common agenda of priority issues for our organizations. The Green in &rsquo;18 campaign will focus its attention on these issue priorities and find opportunities for all candidates in key elections to react to and discuss key issues in the water, air, and energy arenas.</p>

<p><strong>Using the Courts</strong><br />
PennFuture&rsquo;s legal team plans to explore ideas to be more creative and aggressive with our litigation activity. We will continue our good work in the enforcement and regulatory arenas, but can we push harder on litigation around the Environmental Rights Amendment and climate issues? PennFuture&rsquo;s legacy of impact around our legal work has been defined by selecting smart cases that have broad implications. We want our work defined by that criteria, but we want to use the courts fully, especially in times like these when the legislature is actively stymying our ability to advance a clean water, clean air, and clean energy agenda.</p>

<p><strong>Restoring the Ohio River Basin</strong><br />
The Ohio River is at a critical juncture, again named America&rsquo;s most polluted river according to the Environmental Protection Agency&rsquo;s Toxics Release Inventory. But in comparison to our other great river systems, the Ohio Basin is underserved, especially when considering the threat of a multi-state petrochemical complex that will further degrade the basin&rsquo;s air, water and public health.</p>

<p>PennFuture currently is part of two large, multi-state coalitions working to protect local waters of the Delaware River, and the Susquehanna River, respectively. As part of these coalitions, PennFuture is coordinating a large number of state, regional and local groups active in Pennsylvania and in these two major watersheds. PennFuture and National Wildlife Federation seek to begin a closer examination of threats to the Ohio, and working with other organizations, academics and resource managers, begin to craft pathways to environmental health and economic prosperity.</p>

<p><strong>Your Support Makes it Possible</strong><br />
We hope you find these upcoming undertakings of PennFuture worthwhile and exciting, and worthy of your advocacy support and <a href=""https://pennfuture.org/donate"">financial investment in 2018</a>. This list only reflects a small portion of the excellent and impactful work and campaigns that will continue in 2018.</p>

<p>We will continue to build our presence in mid-size towns and communities throughout our state. We will put forth solutions and alternatives to economic development defined by dirty energy. Thank you for supporting our Toxic Neighbor campaign to protect Pittsburgh&rsquo;s air from polluters like U.S. Steel and Royal Dutch Shell. Thank you for supporting our newest office and staff in Mount Pocono, where we are working to protect the headwater streams of the Delaware River Basin. Thank you for making our ability to represent clients through our legal services a reality.</p>

<p>We have a big year planned, and I hope to see you along the way, perhaps at our Women In Conservation event in the Philadelphia area in April, or at our Fall 2018 Solar Tour in Pittsburgh. Together, we will continue to make a difference.</p>
",Environment,"Jacquelyn Bonomo, PennFuture President and CEO"
Give the Gift of Fighting for the Environment,12/19/2017,"<div>This is the most wonderful time of the year. Families and friends gather together to celebrate the holidays and hail in the new year. It inspires generosity and kindness toward those people and causes we love and hold dear.</div>

<div></div>

<div><strong>In that spirit, I want to share a few ways that you can make your holiday giving benefit PennFuture and an investment in your environmental rights:</strong></div>

<ol>
	<li>You can give a <a href=""https://pennfuture.salsalabs.org/2017dec/index.html?eType=EmailBlastContent&amp;eId=46c589f2-a862-4be1-b399-2b8b16533ee6"">gift to PennFuture</a> directly.</li>
	<li>You can give a gift to a loved one by <a href=""https://pennfuture.salsalabs.org/2017dec/index.html?eType=EmailBlastContent&amp;eId=46c589f2-a862-4be1-b399-2b8b16533ee6"">making a gift to PennFuture in their honor.</a></li>
	<li>You can shop for gifts on-line using <a href=""https://www.igive.com/welcome/lp16/cr64a.cfm?eType=EmailBlastContent&amp;eId=46c589f2-a862-4be1-b399-2b8b16533ee6"">www.igive.com</a> (select &quot;Citizens for Pennsylvania&rsquo;s Future&quot;) or on Amazon using <a href=""https://smile.amazon.com/"">Amazon Smiles</a> and designate PennFuture as the beneficiary.</li>
	<li>You can add a <a href=""https://pennfuture.salsalabs.org/2017dec/index.html?eType=EmailBlastContent&amp;eId=46c589f2-a862-4be1-b399-2b8b16533ee6"">&quot;Give to PennFuture&quot; </a>component to your holiday party.</li>
	<li>You can run an <a href=""https://pennfuture.salsalabs.org/2017dec/index.html?eType=EmailBlastContent&amp;eId=46c589f2-a862-4be1-b399-2b8b16533ee6"">end of the year online</a> fundraiser for PennFuture.</li>
	<li>You can have your place of work match your contribution or run a &quot;pay to dress down day&quot; to<a href=""https://pennfuture.salsalabs.org/2017dec/index.html?eType=EmailBlastContent&amp;eId=46c589f2-a862-4be1-b399-2b8b16533ee6""> benefit PennFuture.</a></li>
</ol>

<p>Thank you for your generosity and investment in PennFuture!</p>

<div>Together, we will make 2018 amazing.</div>

<div></div>

<div>#GiveAGiftThatMatters</div>
",Environment,"Jacquelyn Bonomo, PennFuture President and CEO"
Chesapeake Bay Efforts Headed in Right Direction for 2018,12/18/2017,"<p>As we approach the end of this crucial year for the Chesapeake Bay clean-up and efforts to meet its pollution reduction goals, Pennsylvania has taken a number of actions over the last month to capture the status of the state and provide input to the Environmental Protection Agency for the Total Maximum Daily Load&rsquo;s mid-point assessment.</p>

<p>Halfway to 2025, the decisions and efforts Bay watershed states make in 2018 will ensure that they remain (or get on track) to meeting those pollution reduction goals.</p>

<p>In November, the Watershed Implementation Plan (WIP) Steering Committee for Pennsylvania recommended to the Department of Environmental Protection (DEP) that local goals for the WIP should be developed at the county scale and the level of effort for the Bay planning targets should be equal for all jurisdictions in the Chesapeake Bay watershed.</p>

<p>These decisions should be applauded, because they are strong, but feasible and realistic policy decisions for implementing changes and best management practices for Pennsylvania. Rich Batiuk at the EPA Chesapeake Bay Program (CBP) office shared that he believes this was the right way for the Commonwealth, but recent discussions with EPA CBP Director Nicholas DiPasquale remind stakeholders that Pennsylvania should not lose sight of keeping a strong focus on York and Lancaster Counties specifically. Intentional and intensive focus must remain on the South Central Pennsylvania counties, which contribute the most load (nutrient pollutants and sediment) to the Susquehanna and Potomac River basins.</p>

<p>Over the last several months, DEP and EPA have collected &ndash; and continue to collect - a significant amount of data and continuously monitor and analyze information to better perform and make public policy decisions. But, it is important to effectively target and prioritize available funding, technical, and human resources. It is becoming more evident that Pennsylvania should leverage relationships with public-private partnerships, involve the private sector to meet goals, and include innovative technology in its path forward, but these strategies and tactics must be proven to work and be equitable.</p>

<p>At last week&rsquo;s December WIP Steering Committee meeting, stakeholders discussed other essential issues that need to be resolved for the Mid-Point Assessment of the Bay Program. Among these are Pennsylvania&rsquo;s take on the effects of climate change on the Bay watershed, sector growth, and the issue of the Conowingo Dam on the Susquehanna River.</p>

<p>While these are large topics that encompass a great deal of uncertainty, changing landscapes and input needs, Pennsylvania must step up and be a strong leader on climate change in the next WIP and its actions moving forward in the Chesapeake Bay clean-up. Though it should be a team effort with New York and Maryland, addressing the overflowing of sedimentation and pollutants at the Conowingo Dam must include Pennsylvania as an equal party to provide support in finding a solution.</p>

<p>In terms of sector growth, it is imperative that the Commonwealth be thoughtful and include its ramifications in all planning processes. Tomorrow, the Principals&rsquo; Staff Committee of the EPA Chesapeake Bay Program meets to take action on the TMDL mid-point assessment, and we urge strong policies be enacted on climate change, the Conowingo Dam, and growth in the Bay watershed.</p>

<p>It is long past time for Pennsylvania to step up and be a leader in the Chesapeake Bay clean-up, but recent actions provide some hope for next steps. As stakeholders and citizen advocates, we must continue to remind our legislators and executive officials that clean water matters in Pennsylvania. To restore and steward our beloved watersheds in the Commonwealth, we must hold fast our engagement and commitment to rigorous planning goals and targets.</p>

<p>Beside all requirements and goals, I long for the day I can share a few hours of crayfishing with my nephews in the currently impaired Conococheague and paddling in the impaired Susquehanna without fear of dirty water.</p>

<p>My New Year&rsquo;s resolution is to continue pushing hard for clean water in Pennsylvania and share my favorite waterways with friends and family more often. What&rsquo;s yours?</p>
",Environment,"Ezra P. Thrush, Senior Director of Government Affairs"
"Proxy Battles, Bad Omens, and Small Victories: A 2017 Policy Retrospective",12/18/2017,"<div>A war against environmental protection is being waged in Pennsylvania and 2017 was about positioning for the next round of legislative attacks.</div>

<div></div>

<div>Proxy battles were waged through negotiations on the state budget and a proposed severance tax on natural gas, signaling larger efforts to come in 2018. And the legislature continued its dismantling of the Pennsylvania Department of Environmental Protection (DEP).</div>

<div></div>

<div>The callous legislative attacks on foundational clean air, water, and public lands policies continue and are unrelenting.</div>

<div></div>

<div><strong>Nevertheless, it&rsquo;s important to not lose sight of the victories in 2017 that are having tangible impacts and will improve local air quality and boost renewable energy and energy efficiency in the Commonwealth.</strong> Certainly, defending our communities and ecologies from bad legislation is a top priority, but advancing good legislation has been critical to re-engaging the public and policy community to show what good environmental laws can do for people&rsquo;s health, jobs, and living space.</div>

<div></div>

<div><strong>In retrospect, the headlines below best summarize the state of environmental policy in 2017:</strong></div>

<ul>
	<li><strong>Gutting basic protections against oil and gas industry pollution.</strong> A major proxy battle over oil and gas regulations was (and is still being) fought through the severance tax debate. The Senate and Governor agreed to a deal in the summer that would have levied a small severance tax in exchange for weakening the DEP&rsquo;s ability to enact strong permits for industrial activity. In particular, it would have shifted some of DEP&rsquo;s permitting authority to industry-chosen third-party reviewers, as well as forced DEP to approve all permits within a certain period of time, no matter if they&rsquo;re deficient. This bill died in the House, but momentum for gutting DEP permits still remains.</li>
	<li><strong>Allowing unlimited methane pollution.</strong> The Governor has made it a priority to implement the Commonwealth&rsquo;s first ever limits on methane pollution and the legislature is doing its best to stop that from happening. A provision to give the legislature the ability to veto any methane regulations was passed by the Senate and proposed in the House. DEP is advancing new methane limits on new oil and gas infrastructure as I write this blog, setting up a significant battle in 2018 over its success, as well as efforts to implement methane limits on existing oil and gas operations.</li>
	<li><strong>The continued dismantling of DEP. </strong>The FY2017-18 state budget was similar to the last decade in that DEP&rsquo;s budget was cut another 6 to 7 percent, depending on the line item. This adds to the 40 percent already cut in DEP&rsquo;s budget over the last ten years. This hollowing out is having tangible impact, as we see fewer inspectors who can ensure water supplies are safe, fewer inspections of oil and gas activity, fewer permit reviewers, and a smaller number of scientists studying new sources of pollution. For a state with a long history of environmental degradation, it&rsquo;s a stunning and underreported story with long-term consequences, and these shortages leave everyone at risk.</li>
	<li><strong>New subsidies for nuclear plants put on hold. </strong>Nuclear industry efforts for new subsidies benefitting its five Pennsylvania plants didn&rsquo;t gain traction with the legislature in 2017. Instead, the industry pushed the legislature to provide its toothless support for the Department of Energy&rsquo;s (DOE) request to the Federal Energy Regulatory Commission (FERC) to immediately provide support for aging coal and nuclear plants. Depending on what FERC ultimately does with DOE&rsquo;s request dictates whether the nuclear industry will apply significant pressure to get state subsidies in 2018.</li>
	<li><strong>Solar receives a legislative boost. </strong>Solar energy finally received support from Harrisburg. A provision in the state budget (Administrative Code, House Bill 118) includes language to &ldquo;close Pennsylvania&rsquo;s solar borders.&rdquo; What this means is that utilities must source solar energy projects housed in Pennsylvania to meet the Commonwealth&rsquo;s solar target (0.5 percent by 2020), rather than being able to source outside of the state. Under previous law, utilities were sourcing more than 70 percent of its projects from outside the state, stealing jobs and projects from Pennsylvania&rsquo;s solar industry.</li>
	<li><strong>Commercial PACE builds momentum.</strong> Commercial PACE (C-PACE), which provides new financing mechanisms for municipalities wanting to support commercial buildings becoming more energy efficient, took steps forward in 2017. The bill is cosponsored by nearly 2/3 of the state Senate and is poised for passage in 2018.</li>
	<li><strong>Protecting the Delaware River Basin from fracking. </strong>The Delaware River Basin Commission took its next steps toward officially banning oil and gas drilling in the Delaware River basin. While much of this process will play out through 2018, it was an important step toward protecting the important headwaters of the Delaware and the ecology it supports. As it currently stands, the proposed regulations aren&rsquo;t perfect and would still allow fracking fluid to travel from and through the basin. As such, more work needs to be done on the regulations, but the ban on fracking is a major step toward protecting this important water resource for the state.</li>
</ul>

<div>Many of these issues and battles will continue well into 2018, leaving no rest for the weary. There are bad omens signaling further attacks in the near future, but public engagement, perseverance, good science, and strong advocacy are helping turn the tide and beat back, at least some, bad legislation.</div>

<div></div>

<div>I personally started 2017 much more cynically toward what was to come. It had been a bruising 2016 and environmental protection was poised for more rollbacks. But I end 2017 on a positive note. <strong>I see a re-energized environmental community and a general public catching on to the bad deals they&rsquo;re being dealt. </strong>Furthermore, I see pathways to advancing new protections and stopping the agents of greed and environmental destruction from succeeding in making Pennsylvania a wild west for industry and pollution.</div>

<div></div>

<div>Onward and upward.</div>
",Environment,"Matthew Stepp, Vice President and Chief of Staff, PennFuture"
The Arctic National Wildlife Refuge is Not for Sale,12/14/2017,"<p>The Arctic National Wildlife Refuge spans over 19 million acres, a third of which is designated as pristine Alaskan wilderness and is a habitat for polar bears and dozens of other species. Hundreds of thousands of porcupine caribou, native to Alaska, migrate each year through the Coastal Plain. (1) The Arctic Refuge is an incredible example of America&rsquo;s natural legacy and is a symbol to the world that the United States has historically been one of the great stewards of the wilderness.</p>

<p><strong>However, that legacy may soon be tarnished by greed and profit.</strong> On Nov. 16, the House of Representatives passed the first version of the tax bill, which did not include anything regarding the Arctic Refuge. A week later, Senator Lisa Murkowski (R-AK) added a provision to the Senate version of the Tax Bill that essentially opens the Arctic Refuge&rsquo;s Coastal Plain to oil and gas drilling through an auction of lease sales.</p>

<p><strong>The resulting profit would cover only a fraction of the deficit that will result from the deep tax cuts that congressional leaders are proposing. </strong>The Coastal Plain is an ecological center for the wildlife that lives in the Arctic Refuge. Selling off these lands to oil and gas corporations to support tax cuts for the wealthiest Americans makes little economic sense and endangers a national treasure, which will never be able to be replaced once it is gone.</p>

<p>On Dec. 2, the Senate passed its version of the tax bill, which included Senator Murkowski&rsquo;s Arctic Refuge provision. In a process called &ldquo;Reconciliation,&rdquo; representatives from each congressional chamber have been tasked with reconciling differences between the House and Senate versions. Once complete, this compromise bill will return to the House of Representatives for a vote. Unfortunately, reports say that the Arctic Refuge provision will be included in the &ldquo;reconciled&rdquo; bill.</p>

<p>The Arctic Refuge has been imperiled before, but the decision to open the Coastal Plain is a deeply unpopular one. Environmental groups and conservationists across the country are critical of the tax bill, in part because of this provision.</p>

<p>Collin O&rsquo;Mara, President and CEO of the National Wildlife Federation, of which PennFuture is a state affiliate, is one of those leaders who has worked to mobilize action on behalf of preserving this habitat for so many species of animals.</p>

<p>&ldquo;Drilling in the arctic will forever scar one of the remaining truly wild places on earth with a maze of well pads, roads, and pipelines. Destroying critical habitat for imperiled polar bears, porcupine caribou, and musk oxen, not for national security reasons, but for short-term tax breaks that benefit the few, is simply wrong. Some places are too special to drill. We urge members of Congress to defend the Arctic,&rdquo; O&rsquo;Mara said.</p>

<p>The Arctic National Wildlife Refuge is a wildlife refuge first and foremost. It should remain fully protected for the many generations to come.</p>

<p><strong>Use the social media graphic at the top of this page on Facebook or Twitter to tell our representatives that we must continue to defend the Arctic! Use #ProtectTheArctic or #NotADrill and raise your voice.</strong></p>

<p>(1)<a href=""https://www.nwf.org/Magazines/National-Wildlife/2017/Oct-Nov/Conservation/Alaska-Anniversary"">https://www.nwf.org/Magazines/National-Wildlife/2017/Oct-Nov/Conservation/Alaska-Anniversary</a></p>
",Environment,"Alexander Cupo, PennFuture Southeast PA Outreach Coordinator"
