Blog Item Title,Schedule post date,Blog Full Text,Blog Category,Blog Authors
Legislators Target a Severance Tax â€“ in Name Only,7/26/2017,"<p>Over the last few weeks, state legislators have <a href=""/Blog-Item-Harrisburg-Punts-on-Environmental-Protection-in-the-State-Budget-Again"">prioritized raiding conservation funds </a>and cutting environmental protection agencies under the guise of getting serious about balancing the budget.</p>

<p>This was no more evident than when the House of Representatives recently considered a &ldquo;severance tax in name only,&rdquo; in which legislators proposed changing the name of the natural gas &ldquo;Impact Fee&rdquo; to &ldquo;severance tax.&rdquo;</p>

<p><strong>In other words, the House proposed last minute legislative deception to make it look like it passed new revenue.</strong> It&rsquo;s like saying they balanced the state budget by passing a law that changes the word &ldquo;debt&rdquo; to the word &ldquo;surplus,&rdquo; or rebranding carbon pollution as &ldquo;good for farmers and agriculture&rdquo; and calling it <a href=""http://www.nationalreview.com/article/295098/carbon-emissions-are-good-robert-zubrin"">promising for the planet.</a></p>

<p><strong>The Fake Severance Tax Gambit</strong></p>

<p>On Saturday, July 21, the House was convened to develop, debate, and vote on bills that would raise enough revenue to pay for the budget the legislature passed a few weeks earlier. (i) Of environmental concern, legislators proposed taking money from funds dedicated to land conservation, supporting parks, farmland preservation, and water pollution projects to balance the budget. (ii)</p>

<p>The legislature doesn&rsquo;t have to take a sledgehammer to these programs as it has many other revenue options at its disposal, including some that have significant support among the general public. <strong>One of those ideas is implementing a severance tax on natural gas drilling, which has received support from <a href=""http://www.politicspa.com/rmu-poll-finds-support-of-same-sex-marriage-and-extraction-tax/58349/"">58 percent of the public when polled.</a></strong></p>

<p>As such, the House called an Energy and Environmental Resources Committee hearing on July 22to vote on severance tax proposals &ndash; House Bill 113 (Rep. Harper, R) &ndash; which would levy a 3.5 percent severance tax and use the revenue to pay down the pension liability and help balance the budget.</p>

<p><strong>Rather than take up the bill on its merits, House legislators concocted a plan to replace the bill with language that renames the already existing &ldquo;Impact Fee&rdquo; on gas wells a &ldquo;severance tax.&rdquo;</strong></p>

<p><u><strong>I&rsquo;ll state that again so it sinks in:</strong></u><strong> Instead of debating a real severance tax, the legislature wanted to rename an existing fee, and call it a good day&rsquo;s work.</strong></p>

<p>Ultimately, the House didn&rsquo;t follow through with the fake severance tax gambit because members were sent home after an overall budget agreement couldn&rsquo;t be made. But it&rsquo;s indicative of how many more of our legislators are interested in gutting conservation and environmental protection rather than coming up with an equitable budget solution that doesn&rsquo;t require doing so.</p>

<p><strong>Pennsylvania Doesn&rsquo;t Have a Severance Tax</strong></p>

<p>The fake severance tax gambit highlights the common myths holding back its passage, the most prominent being industry&rsquo;s charge that Pennsylvania already levies a severance tax and instead calls it by a different name &ndash; an &ldquo;Impact Fee.&rdquo;</p>

<p>While it&rsquo;s true that the Commonwealth charges a fee on gas wells, it&rsquo;s much different than a severance tax, and the distinction means Pennsylvania taxpayers are leaving hundreds of millions of dollars in potential revenue on the table.</p>

<p>Pennsylvania&rsquo;s Impact Fee is an annual charge on gas wells that is tiered to the price of natural gas and declines over time. It&rsquo;s structured to provide more revenue as the number of gas wells increases. Revenue flows back to municipalities to invest in fixing infrastructure degraded or oversubscribed by increased industrial use. It&rsquo;s a popular program and serves an important purpose, supporting local municipalities with small local tax bases to deal with rising infrastructure costs.</p>

<p>On the other hand, a severance tax charges a percentage of the average market price of the gas extracted, plus a flat fee for every thousand cubic feet of gas extracted. It&rsquo;s structured to provide more revenue as the price of gas increases, or as the amount of extracted gas increases.</p>

<p><strong>It&rsquo;s easy to see why the gas industry doesn&rsquo;t want a severance tax and pushes the argument we already have one.</strong></p>

<p>Their top goal is to increase the price of natural gas in Pennsylvania to increase their profits. They&rsquo;re doing so by limiting new drilling, and building new pipeline projects to sell the gas outside of the state and, more importantly, outside of the United States at a higher price.</p>

<p><strong>As the value of gas increases, a severance tax would become more lucrative, whereas Impact Fee revenue would remain static or decline. Keeping the Impact Fee is more profitable to an already very profitable gas industry.</strong></p>

<p>This act of corporate trickery is having a ripple effect throughout the state budget.</p>

<p><a href=""https://www.pennbpc.org/no-matter-how-you-figure-it-severance-tax-generates-more-revenue-impact-fee-and-clearly-better-deal"">The Pennsylvania Budget and Policy Center estimates </a>that the Commonwealth would raise at least $480 million more revenue per year through a severance tax than the Impact Fee.</p>

<p>In other words, Pennsylvania is leaving a significant amount of budget revenue on the table by not levying a severance tax and are instead cutting core environmental protection programs to try and balance the budget.</p>

<p><strong>Calling a Spade a Spade</strong></p>

<p>To be fair, balancing the budget always includes a mix of budget cuts and new revenue. Both are needed to equitably close a <a href=""http://www.witf.org/state-house-sound-bites/2017/06/breaking-down-the-budget-the-political-path-to-pas-structural-deficit.php"">$3 billion structural deficit</a> that has dragged on too long. Calling a spade a spade, the legislature isn&rsquo;t acting fairly and is eviscerating environmental protection and conservation programs and selling it as needed budget cuts.</p>

<p>For over a decade, the legislature has stripped to the bone the Commonwealth&rsquo;s environmental protection programs and support for our parks and forests. These agencies currently can&rsquo;t complete their most basic functions, like protecting the public&rsquo;s <a href=""http://pittsburgh.cbslocal.com/2017/02/02/u-s-warns-pennsylvania-over-safe-drinking-water-violations/"">drinking water</a> or cleaning up the <a href=""http://lancasteronline.com/news/local/pennsylvania-lags-on-chesapeake-bay-cleanup/article_2ff5229e-40ba-11e6-98be-df8ac8dc9c42.html"">Susquehanna River basin</a>. Parks and forests are understaffed and are sitting on years of past maintenance backlog <a href=""http://paenvironmentdaily.blogspot.com/2013/02/senate-budget-hearing-dcnr-has-1.html"">exceeding $1 billion.</a></p>

<p>Certainly, times are tough for state budgeting, but these fundamental state programs have given <a href=""http://paenvironmentdaily.blogspot.com/2017/06/house-senate-governor-agree-on-31996b.html"">more than enough</a> toward balancing the budget. Rather than dangerously cutting environmental protection programs yet again, as well as taking dedicated money from land conservation and water projects, legislators need to look elsewhere to balance their budget.</p>

<p><strong>This includes taking a hard look at their rhetoric around a severance tax (and other potential revenue raisers) and asking whether protecting <a href=""https://www.fool.com/investing/2017/07/26/can-the-marcellus-shale-continue-fueling-big-profi.aspx"">soaring</a> gas industry profits is worth harming the Commonwealth&rsquo;s environment and public health.</strong></p>

<p><em>(i)Note that the legislature already slashed environmental investments this year. The FY2017-18 budget cuts water, land, and air protection and conservation programs by 2 percent to 7 percent compared to last year&rsquo;s budget (and up to 33 percent compared to these budgets 15 years ago).<br />
(ii)Specifically, the legislature was targeting: (1) Environmental Stewardship Fund, which supports everything from greenways, trails, and community parks to water cleanup and wildlife habitat protection; (2) Keystone Recreation, Park, and Conservation Fund, which is the chief way Pennsylvania conserves and protects public lands and historic sites as well as invests in libraries, public parks, and new lands for recreation; and (3) Farmland Preservation Fund, which is how state and county governments purchase conservation easements to preserve Pennsylvania farms to slow the selloff of those lands for development.</em></p>


",Environment,"Matt Stepp, Director of Policy"
Meet the Donor: Rodney Gasch,7/25/2017,"<p>Rodney Gasch, a retired freelance writer and current president of the Latin American Children&rsquo;s Fund and president of Historic Harmony, Inc., has been a long-time PennFuture donor. In 2016, Rodney and his wife, Laurie, decided to change things up and become monthly supporters.</p>

<p>As Rodney said, &ldquo;Giving once a year is important, but PennFuture, like most nonprofits, has expenses 12 months a year.&rdquo; It was an easy decision for he and his wife to make the switch.</p>

<p>Rodney grew up in eastern Wisconsin on a small family dairy farm. His father participated in land conservation and farmed carefully to avoid soil erosion, giving Rodney the bird&rsquo;s eye view to learn about the importance of both stewardship of the land, and erosion control.</p>

<p>On their farm, they practiced contour tillage (tilling perpendicular to a slope), strip cropping (alternating long strips of row crops, such as corn, with long strips of dense hay crops) and utilized grass waterways (broad, shallow channels planted in grass that move surface water across slopes without causing soil erosion).</p>

<p>In 1993, Rodney and his wife moved to Pennsylvania as Laurie accepted a position at the University of Pittsburgh. They bought a non-functioning farm with a great barn and nice farmhouse. Most of the land had grown in with trees. While it is beautiful to look at, Rodney says the most successful plants on the farm seem to be poison ivy, multi flora rose, and autumn olive, the latter two growing into dense thickets that can crowd out native species. Rodney worked in marketing communications as a freelance writer, specializing in product literature and direct mail for agricultural and equipment manufacturers.</p>

<p>Rodney and Laurie are the proud parents of William and Noah, whom they adopted from El Salvador and Guatemala, respectively. Their first adoption 27 years ago spurred an interest in the boys cultures, but Rodney did not get heavily involved in charity work in Central America until 2006.</p>

<p>At the Latin American Childrens fund, Rodney and his team raise money for a rural medical clinic in El Salvador, as well as helping the poor with micro enterprises that build economic stability and self-worth. In Guatemala, a program provides scholarships to help children continue their educations past the sixth grade. Working with local charities that have &ldquo;boots on the ground,&rdquo; they direct their efforts toward issues that are way beyond the reach of rural poor and subsistence farmers.</p>

<p>Historic Harmony, Inc. was founded in 1943, and operates eight properties, including the 1809 Harmony Museum building, which interprets 250 years of rich history in western Pennsylvania. The group provides presentations that include the topics of George Washingtons 1753 mission, the Harmonists, Mennonites, and the Ball Collection of outstanding sporting rifles by 19th century Harmony gunsmith Charles Flowers. Historic Harmony is also home to the oldest Mennonite meetinghouse west of the Allegheny Mountains. It was recently added to the National Register of Historic Places.</p>

<p>Two years ago, Historic Harmony, Inc. asked for PennFuture&rsquo;s help to take on a developer who planned to fill and develop a farm field in a flood plain. While Historic Harmony, Inc. wasn&rsquo;t able to stop the entire process, with PennFuture&rsquo;s help, the organization gained a better understanding of what it could do to prevent the size and scope of the development. Through these efforts, Historic Harmony, Inc. was able to identify and protect several acres of wetlands and prevent the development in the flood way.</p>

<p>Rodney first became interested in supporting PennFuture when Marcellus gas development became a larger statewide topic. Rodney and his wife were some of the first people to sign a Marcellus gas lease in Butler County, long before Marcellus, fracking, and horizontal drilling became household terms. They quickly learned that without strong rules and vigilant oversight, gas companies were prone to cut corners, especially on environmental issues. </p>

<p>&ldquo;Their goals are speed and profits, not land stewardship,&rdquo; notes Rodney. He and his wife felt it was fitting to put some of the money they received from gas development back into a group that would strive to enforce those rules, and be the watchdog over gas drillers and the legislature.</p>

<p>&ldquo;We got to thinking, whos going to speak for the environment? Businesses speak for their bottom line. Gas folks can influence the legislature. Who speaks for the land and the water and the air?&rdquo; Rodney thought PennFuture was the best group to stand up for those issues.</p>

<p>In terms of gas drilling, Rodney is not opposed to resource development, but feels that development must be done with a keen eye toward long-term environmental impact.</p>

<p>&quot;Initially, the technology of gas extraction was way ahead of the rules. We have made some progress, but if we didn&rsquo;t have an organization like PennFuture pushing back against the gas drillers and pipeline companies, we could easily repeat the environmental mistakes made In Pennsylvania in the 19th and 20th centuries&mdash;mistakes that gave us acid mine drainage, methane leaks, and abandoned strip mines,&rdquo; Rodney said.<br />
<br />
PennFuture thanks Rodney and Laurie for their monthly support.</p>
",Environment,"Susanne Whitehead, Director of Donor Relations"
Oil Trains: What is the Threat?,7/12/2017,"<p>People have lived amongst trains for more than 200 years. Trains are by far one of the oldest and most successful vehicles of world history, delivering goods and people quickly and efficiently across the United States and beyond.</p>

<p>While it is an incredible machine navigating an incredible rail system, I am often struck by a different perspective of the train, the goods they can carry, and what they represent.</p>

<p>I began to wonder and really think about oil trains about two years ago, when I discovered oil trains have been running through my community. Since then, oil trains have become one of my all-time favorite talking points, and learning about them has changed my life.</p>

<p>It&rsquo;s funny to me now that I have been hearing the whistle of these trains in the far away distance at night since I was a kid. I grew up in Southwest Philadelphia, and oil trains have been a part of my life for years even though I didn&rsquo;t know about them.</p>

<p>Now that I recognize oil trains&mdash;which can have more than 100 cars at one time&mdash;they are hard to miss. Just knowing the cars that they carry are filled with volatile crude oil has changed the way I see these trains.</p>

<p>Seeing the black tanker cars feels like a slap in my face, and an annoyance that keeps popping up in the most unexpected places. These black, pill-shaped disasters-just-waiting-to-happen continuously show up in our neighborhoods. I no longer have to search for them; instead it feels like they are looking for me.</p>

<p>The presence of oil trains in my city, and in the other communities is the embodiment of intimidation. My relationship with these black tanker cars has transformed into one that feels strange and slightly personal. In my head, oil trains are the physical representation of the terms, ideas and institutions that shape our reality. When I see oil trains, I hear the tanker cars whisper, &ldquo;capitalism,&rdquo; &rdquo;classism,&rdquo; &ldquo;colonialism,&rdquo; &ldquo;climate change,&rdquo; &ldquo;industry deregulation,&rdquo; and &ldquo;powerlessness.&rdquo;</p>

<p>See, in my eyes, fractivism (anti-fracking activism), and activism around the reality of oil trains are spiritual practices. There is a subliminal message that each tanker car delivers to the communities that they travel through, and a destructive aura that each tanker car exudes. When I look at these trains and listen to their sounds, I hear them spew messages like: &ldquo;This is how things are and will continue to be.&rdquo; &ldquo;You are powerless to change our fossil fuel economy.&rdquo; &ldquo;Your health and safety means nothing to the interests of industry and their beneficiaries.&rdquo; &ldquo;You are inferior to the systems that uphold destructive power dynamics.&rdquo;</p>

<p>But the movement and saying, &ldquo;STOP OIL TRAINS!&rdquo; have become a war cry for activists like me for this very reason. Halting the use of oil trains has the potential to end a lot of the negative things that travel with them. It can end community members having to ask questions like: &ldquo;What is in these tanker cars?&rdquo; or &ldquo;Where are these trains coming from?&rdquo;</p>

<p>And ultimately, if we stop oil trains, it can end community members having to ask, &ldquo;What will happen if one of these trains derails?&rdquo;</p>

<p>I am currently attending school in Kutztown, Pa. and I still see oil trains traveling through a nearby town named Topton. I haven&rsquo;t heard anyone in this area speak up against oil trains, which feels similar to my experience living in Southwest Philly, and even how I feel now living in Southeast Delaware County (where I have also seen many oil trains passing through).</p>

<p>One consistent observation that I&rsquo;ve had in all of these communities is that the people most impacted and most vulnerable to an oil trains disaster know little to nothing about the existence of them. And that is by far the most frustrating (and motivating) part of this work.</p>

<p>Whenever I travel or move I find oil trains and community members who don&rsquo;t yet know the danger traveling with those tanker cars.</p>

<p>We must inform the people who don&rsquo;t know about the presence and dangers of oil trains and get them involved in standing up for their communities. If we can take that first step together, and if everyone living in a neighborhood next to these oil train routes can also see the reality of oil trains that I see (as a slap in the face to all communities with a right to a safe environment), then I believe that we can begin to make a bigger push to move away from reckless fracking and fossil fuel transportation.</p>

<p><em><strong>Please join us in Philadelphia this Thursday, July 13 for a special premiere of an oil trains documentary, featuring Jeremy and his work. <a href=""/oiltrains"">Click here for more details.</a></strong></em></p>


",Environment,"Jeremy R. Griffin, Activist and Student at Kutztown University"
