Blog Item Title,Schedule post date,Blog Full Text,Blog Category,Blog Authors
The State Budget Negotiations are Poison Pill for PAâ€™s Environment,5/22/2017,"<p>Over the last 10 years, Pennsylvania&rsquo;s state budget has consistently put the environment and public health at risk.</p>

<p>Deep budget cuts and sneaky policy provisions have undermined the Commonwealth&rsquo;s ability to keep drinking water safe, hold polluters accountable, and provide a clean and healthy environment for all. The FY2017-18 budget negotiations look to make this bad situation even worse.</p>

<p>While the media and general public focus on top-line items, such as education funding, total government spending, debts, and deficits, the budget determines how much or how little investment goes into environmental protection. <a href=""http://www.pennlive.com/news/2017/03/drink_water_in_pennsylvania_tr.html""><strong>The state budget process ultimately allows legislators to determine how many inspectors the state has to oversee your drinking water.</strong></a></p>

<p>This process determines how often the state inspects drilling operations and determines which permits are issued for conducting industrial operations safely. It determines whether or not grants are provided to communities to support recycling, how much funding is given to maintain our state parks, and also determines which funds are given to support park and forest facilities.</p>

<p>The budget allows legislators to choose whether or not to invest in storm water buffers to keep pollution out of our streams, and in spraying to keep West Nile Virus and other insect borne diseases away from our families.</p>

<p>The budget process has the potential to allow the state to carve out resources that direct investment toward cleaning up the Susquehanna River and reclaiming old coal piles. It could help to protect where we fish, swim, hike, ATV, recreate, and live.</p>

<p><strong>The kicker: </strong>we depend on our elected officials to make good choices about the environment, and ultimately, it is up to them. The state budget process is one in which we could make great environmental strides by investing in public health. But it all depends on the priorities and the decisions made by Governors and legislators.</p>

<p><strong>Over 10 Years of State Budget Cuts to Environmental Protection</strong><br />
Unfortunately, for the last 10 years, governors and legislators have cut investment in environmental protection, making it increasingly difficult to provide even the most fundamental oversight.</p>

<p>From FY02-03 through FY16-17, state investment in the Department of Environmental Protection (DEP) has been cut by 53 percent, adjusting for inflation. There has been a corresponding increase in federal grants to DEP of 14 percent, but it&rsquo;s nowhere near enough to make up for the cuts in state funds.</p>

<p>During the same time period, state investment in the Department of Conservation and Natural Resources (DCNR) has been cut by 24 percent, accounting for inflation. There has been a 65 percent increase in federal grants, but because the increase was starting from a very small base, the overall increase doesn&rsquo;t cover the cuts in the state share.</p>

<p>Making matters worse, both DEP and DCNR&rsquo;s budgets rely significantly on special spending accounts, separate from state appropriations, for between 30 to 70 percent of its overall budget. These funding accounts are where revenue from fees and fines are collected and directed by law to specific activities at the agency, such as oil and gas royalties from public lands, waste fees, and permitting fees.</p>

<p>In FY2016-17, both DEP and DCNR&rsquo;s overall budget relied on these funds for 42 percent of its revenue. Yet, the revenue provided from these funds has decreased by 26 percent at DEP and 18 percent at DCNR since FY 2002-03 because the legislature has diverted those funds to other programs, or the funds haven&rsquo;t been updated in years and are accruing less and less dollars every year.</p>

<p>What does all of this mean? Pennsylvania has consistently cut state funding for protecting our air, water, and public lands, while failing to update our laws to keep agency funding accounts up-to-date. This has led to a dereliction of duty. Our state government isn&rsquo;t provided the funding and tools to fulfill its mandate to protect our environment for present and future generations.</p>

<p><strong>The FY2017-18 State Budget Aims to Make a Bad Situation Worse</strong><br />
Pennsylvania&rsquo;s ability to protect the environment is nearing a moment of crisis, yet there is little urgency to address the problem through the state budget. In fact, the Governor proposed a state budget that continues the status quo, while the House of Representatives has passed House Bill 218, which makes environmental funding remarkably worse.</p>

<p>HB 218 is a disaster for DEP and DCNR. It proposes cutting DEP&rsquo;s General Operations by 10 percent, its Environmental Programs by 6.5 percent, and its Environmental Protection programs by five percent. It cuts all river basin commissions by up to 50 percent and hacks 8 percent from the Chesapeake Bay program. These cuts put DEP&rsquo;s ability to protect our water resources in a dire situation, while stressing its basic functions, like permit oversight, to a level never seen at the agency.</p>

<p>It also cuts DCNR&rsquo;s budget by $2.8 million, which would result in rolling closures of state parks, a lack of maintenance at public facilities, and the elimination of key programs that support trails, road maintenance for hunters at state forests, and programs that battle forest fires.</p>

<p>In the coming weeks, PennFuture will keep a close eye on state budget negotiations and make sure that we keep you &ndash; our readers, members, and the general public &ndash; apprised of what the legislature is doing with your environmental protection agencies.</p>

<p><strong>Early indications aren&rsquo;t good and the public needs to tell their elected officials cutting DEP and DCNR is unacceptable. <a href=""http://www.legis.state.pa.us/cfdocs/legis/home/findyourlegislator/"">Click here to find and contact your legislator today.</a></strong></p>
",Environment,"Matt Stepp, Director of Policy"
PennFuture Goes to the Peoples Climate March in D.C.,5/19/2017,"<p><em>The Peoples Climate March was held in Washington, D.C. on April 29, the 100th day of President Donald Trumps presidency. PennFuture staff and members attended the event and shared what their experiences were like below:</em></p>

<p><em><img  src=""/Files/Admin/char%2EJPG"" style=""width: 400px; height: 586px;"" /></em></p>

<p><strong>Char Magaro, Board Chair, PennFuture</strong><br />
In the age of instant messaging, Internet petitions and Facebook posts, attendance and being counted as &quot;one who was there&quot;is more important than ever, especially when the issue(s) are as critical as climate change and political obstruction, as profound as it is today. Marching is not only inspiring and empowering: the images of filled streets gives legitimacy to the cause.</p>

<p><img  src=""/Files/Admin/jacqui%2EJPG"" style=""width: 400px; height: 697px;"" /></p>

<p><strong>Jacqui Bonomo, Executive Vice President and COO, PennFuture (pictured right)</strong><br />
A favorite chant heard during the march went like this: <em>Call:</em>&ldquo;Tell me what democracy looks like?&rdquo; <em>Response</em>: &ldquo;This is what democracy looks like!&rdquo; I feel with our children&rsquo;s climate and environmental future at stake and under attack, citizens must avail themselves of every chance to play a part in their democracy. So, I wanted to march. And for those who can&rsquo;t march, we can all make our voices heard through a steady flow of phone calls to our elected officials demanding them to do their jobs, and protect our environment, climate and democracy.</p>

<p><img  src=""/Files/Admin/zakiamarch%2Ejpg"" style=""width: 400px; height: 533px;"" /></p>

<p><strong>Zakia Elliott, PennFuture Southwest Pa. Outreach Coordinator</strong><br />
How we choose to treat the environment has a direct impact on our lives, our public safety, and our health. Within President Trump&rsquo;s first 100 days, we have witnessed unprecedented attacks onour public health through executive orders, regulatory reform, and proposed budget cuts. The people of the United States have a right to a clean and healthy environment, and that right cannot come second to the interests of fossil fuel companies.I will not stand for it, and the people of Pennsylvania will not stand for it.</p>

<p>This is my first large climate march, and I&rsquo;m so proud that I worked with Conservation Voters of PA to organize a busload of Pennsylvanians to join more than 200,000 people marching in Washington, D.C. These are only the first 100 days of this Administration&rsquo;s irresponsible and extremely dangerous decision-making. We will be called to defend our health, our safety, and our values as a nation. I&rsquo;m proud that PennFuture is taking a stand and that we are working with our members to elevate their demands to their representatives and other key decision makers.</p>

<p><img  src=""/Files/Admin/suki%2Ejpg"" style=""width: 241px; height: 321px;"" /></p>

<p><strong>Sukie Ream</strong><br />
I live in Philadelphia and I am really concerned about our environment. I&rsquo;m here to stand with everybody else who wants to make sure we save our planet, along with everything, everybody, and every animal on it.</p>

<p><img  src=""/Files/Admin/glenavieandpatricia%2Ejpg"" style=""width: 241px; height: 321px;"" /></p>

<p><strong>Glenavie Norton</strong><br />
I&rsquo;m Glenavie and I&rsquo;m here because I think there is no issue that&rsquo;s more important to us than climate change and I&rsquo;d like to address it.</p>

<p><strong>Patricia Stewart</strong><br />
My name is Patricia and I came because I think the environment is the issue that bridges all of the issues.</p>

<p><img  src=""/Files/Admin/carlmarch%2Ejpg"" style=""width: 241px; height: 321px;"" /></p>

<p><strong>Carl Balis from Glenolden, PA, outside of Philadelphia</strong><br />
I came for the simple reason that Donald Trump&rsquo;s policies are destroying the world I live in. Some examples include cutting funding to National Parks, wanting to open up National Monuments to drilling and mining, wanting to destroy&mdash;actually dismantle--the EPA entirely, relaxing pollution standards on coal companies, allowing them to pour poisons into streams, and on and on and on. And common sense says that&rsquo;s a kind of suicide. It&rsquo;s obvious if you destroy the world you live in that the money you might make from the jobs and the business you create is not going to go too far. Where will you spend it? That&rsquo;s why I&rsquo;m here.</p>

<p><strong>Michelle Landau</strong><br />
I came out today because I&rsquo;m sure there is not a single other issue that will matter if we don&rsquo;t address being able to live on this planet for a long time.</p>
",Climate,"Zakia M. Elliott, Southeast PA Outreach Coordinator"
Clean Energy Pittsburgh: Leading the Way,5/18/2017,"<p><em><a href=""http://pennfuture.org/News-Clean-Energy-Pittsburgh-Convenes-First-Community-Workshop"">The first ever Clean Energy Pittsburgh workshop</a> took place in Millvale, Pa. on Friday, May 12. Brittany Reno is one of the participants and a local leader who is passionate about moving her community towards clean energy. Clean Energy Pittsburgh is a PennFuture initiative funded by The Pittsburgh Foundation.</em></p>

<p>Clean energy is important to me because I represent a community that is facing substantial challenges around air quality and stormwater management, which is why I am enthusiastic to have the opportunity through PennFuture&rsquo;s Clean Energy Pittsburgh cohort to learn from the successes and challenges of similar communities at a crossroads.</p>

<p>Being nestled in a river valley between an active industrial railroad and a major highway, Sharpsburg often finds itself bearing the burdens of heavily polluted air and overwhelming stormwater flooding, and we&rsquo;re at a critical point where it&rsquo;s dangerous and impossible to continue ignoring the huge impact that we&rsquo;re having on our environment&mdash;and vice versa.</p>

<p>I represent Sharpsburg as both a borough council member and as the executive director of Sharpsburg Neighborhood Organization, a resident-driven community development nonprofit. In both of these roles, I advocate for community-supported local improvements that make the borough a safer and healthier place to live. It&rsquo;s especially important to me to advocate on behalf of stakeholders who aren&rsquo;t typically represented at local decision-making tables; I have found that the needs of children, people of all ages who are living in poverty, and the environment itself are generally under-represented in discussions around legislation and development.</p>

<p><strong>Clean energy and sustainable community planning are not just environmental issues; they&rsquo;re issues of public health, economic opportunity, and social equity.</strong> When the air breathed by people in low-income communities is filled with cancer-causing soot particulates, and those same people must bankrupt their families and futures to finance health care treatments to deal with these problems, it&rsquo;s clear that the issue of clean energy is a life or death matter, not a niche environmentalist issue.</p>

<p>My biggest takeaway from the first Clean Energy Pittsburgh workshop is that it&rsquo;s not enough to stand by and wait patiently for federal or state lawmakers to lead the way on saving our planet. In a time when big-money corporate interests have a stranglehold on our political process, I&rsquo;m convinced that the drive for widespread investment in clean energy will be most effective as a grassroots movement, an entire nation of small towns like mine filled with normal people like me rising up and demanding that we as a society do better for our children and grandchildren by doing what&rsquo;s in our power to protect and repair the environment. Our representatives need to start legislating based on the health and safety of the people and the environment, not the profits and bonuses of soulless, lungless corporations.</p>

<p><strong>I call on other community leaders to get involved at the local level because there is strength in numbers.</strong> Your impact as one community of 3,500 people will not save the world, but when we band together and galvanize individuals across the state and across the country to action, it sends a message that gets harder and harder to ignore at the state and federal levels. We deserve clean air to breathe and clean water to drink. We should not get cancer from breathing the air around us, and our legislation should reflect that right. <strong>Your actions at the local level, multiplied in inspired towns across the country, truly do have the power to save the planet for those of us who live on it.</strong></p>

<p><strong>We can win, so long as we care enough to work hard and fight fair. Let&rsquo;s get to work.</strong></p>


",Energy,"Brittany Reno, Sharpsburg Council Member"
A Voice in Defense of Science,5/15/2017,"<p>We often take certain things for granted in life. One of those for me was the difference between personal opinions and scientifically verifiable facts. I never thought I would have to march to defend the very notion of science itself.</p>

<p>Like tens of thousands of others in many cities around the world, I marched with PennFuture&rsquo;s staff and 20,000 volunteers stretching across ten blocks across Center City Philadelphia during the March for Science on April 22. During this march, we gave support to the scientists who are under fire from dark-money contrarians, climate deniers, and even the administrator of the Environmental Protection Agency, who himself rejects climate science, and our own president who thinks that climate change is a Chinese hoax.</p>

<p>We started at Philadelphia City Hall, which is crowned by a statute of one of America&rsquo;s earliest noted scientists, Ben Franklin. It was appropriate that a Franklin look-alike led our march as he was not just a founding statesman, inventor, and author of &ldquo;Poor Richards Almanack,&rdquo; but he also was one of America&rsquo;s first scientists. Among his scientific advancements, Franklin charted the powerful Gulf Stream that enabled ships sailing for Europe to double their speed.</p>

<p>Franklin also launched the American Philosophical Society in 1743 to pursue &quot;philosophical experiments that let light into the nature of things, tend to increase the power of man over matter, and multiply the conveniences or pleasures of life.&quot; Franklin knew that the advancement of science and the application of knowledge would greatly benefit society. He also believed that curiosity and experimentation would lead to greater light into the nature of things. </p>

<p>In a modern social system as in Franklin&rsquo;s day, certain principles and values are inherent to the proper functioning of community. Since the 18th century &ldquo;Age of Enlightenment,&rdquo; science-based decision-making has been central to nearly every societal advancement.</p>

<p>Science leads the world towards greater and greater progress, as we find new ways to tackle old problems. PennFuture shares Franklin&rsquo;s view of science, as we are an environmental organization committed to science-based advocacy for the advancement of a safe, healthy and sustainable society. We depend upon science to provide critical answers to the most vexing air and water pollution problems. Soil science properly applied yields greater productivity while retaining nutrients and sediments. Clean energy built on advancing technologies provides clean, carbon-free energy to meet the demands of a 21st century society.</p>

<p>The highly-respected astrophysicist Neil deGrasse Tyson said it best: &ldquo;The good thing about science is that its true whether or not you believe in it.&rdquo; Whether policymakers believe in science or not is irrelevant, facts are stubborn and cannot be just legislated away. Should society irrationally abandon authoritative science and turn once again to superstitions and myths, then we will certainly drift into the tyranny that created the Dark Ages.</p>

<p>Upon hearing that President Trump wants to cut climate science funding and dismantle EPA&rsquo;s science advisory group, the newly elected French President Emmanuel Macron says France wants our top climate and clean-tech researchers to move to his country, where they will be understood and respected. The French president knows that science and innovation will underpin the winning nations in the future as it has in the past.</p>

<p>Can we afford to lose our scientific edge and just ignore or discount the warnings of climate scientists? Can we simply publish textbooks that avoid objectionable scientific conclusions and pejoratively label innovators and leading thinkers as &ldquo;coastal elites?&rdquo; When a highly vocal chorus of ill-informed voters repeatedly reject basic truths and pursue myths and alternative facts concocted by those who obfuscate, we must ask, perhaps are we a society encountering the very boundaries of human enlightenment? I, for one, certainly hope not, but that is no longer a given.</p>

<p>Franklin was a strong proponent of &quot;enlightened&quot; rationality &ndash; and we agree. Please help PennFuture carry the banner of enlightenment to confront the myths and disinformation that is causing so many to stumble and threatening the very inhabitability of much of our planet.</p>
",Environment,Larry J. Schweiger
First Person: My Experience at the Harrisburg March,5/11/2017,"<p>On the date marking President Trump&rsquo;s first 100 days in office, PennFuture staff and members joined colleagues fromSierra Club - Pennsylvania Chapter and the Conservation Voters of Pennsylvania in Harrisburg by marching for clean air, pure water, and a healthy climate. The president observed his first 100 days in office with a rally in our city, and we wanted to make it clear that climate change is real and it is an issue that must be addressed.</p>

<p>It was a warm and humid day, much like any summer day in Pennsylvania, but overcast, and our city was electric with anticipation. People from across the state and country descended upon the Capital City.</p>

<p>Upon learning that President Trump and Vice President Pence would be speaking at a rally at the Pennsylvania Farm Show Complex to tout victories and accomplishments of the administration, our environmental community banded together with other statewide and local community organizations in Harrisburg to stand up against the President&rsquo;s dangerous and damaging environmental policies.</p>

<p>While more than 200,000 of our neighbors and allies marched on Washington, D.C. during the People&rsquo;s Climate March, held on the same day, we decided to make a statement to President Trump that he could not take shelter in the Keystone State from listening to our voices and our earth. We aimed to bring the energy of the People&rsquo;s Climate March to Harrisburg and remind President Trump of his obligation to lead on environmental issues.</p>

<p><img  src=""/Files/Admin/ezramarch%2Ejpg"" style=""width: 400px; height: 533px;"" /></p>

<p>During his first 100 days in office, President Trump dismantled hard-won climate protections, issued assaults on our air, water, and land, directly attacked the well-being of working families, and marginalized Indigenous communities, people of color, immigrants, the LGBTQIA community, women, young people, and low-income communities. Further, the President&rsquo;s policies have attacked national monuments and the Endangered Species Act, and put at risk key funding for our farmers and watermen through the Chesapeake Bay Program and the Great Lakes Restoration Initiative.</p>

<p>By any and all measurements, the first 100 days of the Trump Administration and the Scott Pruitt-led Environmental Protection Agency (EPA) have completely failed when it comes to protecting our health and environment. In fact, virtually all of Trump&rsquo;s environmental actions have put public health at greater risk, exposing us to dangerous pollution from power plants, cars and other sources, and toxic chemicals in our water and pesticides on food kids like to eat.</p>

<p>President Trump and EPA Administrator Pruitt have also failed to push clean energy and the jobs that come with it. Their unprecedented actions that jeopardize the safety of Americans are squarely at odds with what, in poll after poll, the American people want: clean air and safe water, clean energy, action on climate, and for their government to hold polluters accountable.</p>

<p>Specifically in Pennsylvania, farmers&rsquo; crops are being hurt by the changing climate, outdoorsmen are encountering diseased game, fishermen are finding sick bass, public drinking water in a number of municipalities face lead contamination, and our cities are experiencing flooding and stormwater problems at new, out of control levels.<br />
We gathered around in the early evening among the state&rsquo;s towering administrative buildings to speak truth to power. After listening to uplifting speeches from friends, nearly 500 citizens marched up 7th Street to Maclay Street before moving over to Cameron Street by the Farm Show Complex. It was a beautiful evening as the sun set and we were met with the community support of honking cars and cheers as we passed by the different city neighborhoods.</p>

<p>As Vice President Pence left the event, we made sure to share our signs and chants with him, and we did the same as President Trump&rsquo;s motorcade left the location and pulled onto Cameron Street back to Washington. The evening put over six miles of trekking on the marchers, but seeds were planted, and an overwhelming spark of empowerment in our fellow marchers was evident. It resonated long after the night concluded.</p>

<p>We marched, because all Pennsylvanians deserve a voice. All Pennsylvanians, no matter their station, have a right to clean air, pure water, and the preservation of our environment. It is the duty of the Commonwealth to serve as trustee of Pennsylvania&rsquo;s precious resources for not just the rich, and not just the powerful, but for all. We must continue to advocate for conservation and our environment. <strong>We must continue to show up and share our stories, not only by marching in the streets, but by continuing our work in the halls of the State Capitol and in Washington.</strong></p>


",Environment,"Ezra P. Thrush, Senior Director of Government Affairs"
