Blog Item Title,Schedule post date,Blog Full Text,Blog Category,Blog Authors
PennFuture Opposes Any Repeal of the Clean Water Rule,9/27/2017,"<p>Today, <a href=""http://www.pennfuture.org/Files/Admin/2017-09-27-PennFuture-Clean-Water-Rule-Repeal-Public-Comments-%28EPA-HQ-OW-2017-0203%29.pdf""><strong>PennFuture submitted public comments </strong></a>urging the Trump Administration not to repeal the federal Clean Water Rule.Repealing the Clean Water Rule would threaten Pennsylvania&rsquo;s clean water, outdoor economy, and safe drinking water for millions of citizens.</p>

<p>One of the most important aspects of the Clean Water Rule is its protection of the sensitive, smaller waters critical to safeguarding water quality and wildlife throughout Pennsylvania.Small headwater streams and wetlands provide the greatest connections between land and water, trapping and storing nutrients, providing critical habitat, storing floodwaters, contributing to drinking water supplies, and filtering out pollutants. These streams are essential to protect drinking water; in Pennsylvania 58% of the streams that provide water for surface water intakes that supply public drinking water are intermittent, ephemeral, or headwater streams.But just as importantly, headwater streams have biological, chemical, and hydrologic connections to downstream waters.Scientific studies repeatedly demonstrate that the health of downstream lakes, rivers, and estuaries are directly tied to the health of their smaller headwater streams and wetlands. Leaving these critical headwaters vulnerable to pollution puts the health of all of our rivers and the communities that depend upon them at risk.</p>

<p>Case in point: according to a recent analysis, repealing the Clean Water Rule would result in a loss of Clean Water Act protections to 55% of all stream miles in the Delaware River Watershed.These intermittent, ephemeral, and headwater streams in the Delaware River Watershed provide not only clean drinking water but are also spots for outdoor recreation and esthetic enjoyment of the natural environment. A repeal of the Clean Water Rule would put all of this at risk.</p>

<p>And although Pennsylvania has the Clean Streams Law, which protects the &ldquo;waters of the Commonwealth,&rdquo; this federal Clean Water Act jurisdictional issue can directly impact water quality protections in Pennsylvania.</p>

<p>For example, Section 401 of the Clean Water Act requires that any federally-permitted project that may discharge into a &ldquo;navigable waterway&rdquo; (the definition of which includes &ldquo;waters of the United States&rdquo;) cannot proceed unless the state certifies that the discharge will not violate state water quality standards. Quite simply, should the federal government narrow the definition of &ldquo;waters of the United States,&rdquo; smaller but ecologically important streams and wetlands, which likely suffer greater impacts from these projects than larger waters, will lose this protection under the Clean Water Act. An important aspect of the 401 Water Quality Certification process is that states may deny a certification or impose conditions as part of its certification to ensure that the applicant complies with any applicable state law. These conditions then become a part of the federal permit. If a project avoids the need for state certification because the federal government narrows the definition of &ldquo;waters of the United States,&rdquo; the states lose this ability to protect their waters by either denying the certification and halting the project or imposing federally-enforceable conditions to ensure that the project will not harm state water resources.</p>

<p>Additionally, and as a very practical matter, this loss of clear protection at the federal level for these critical headwaters and wetlands could result in the future weakening of protections in Pennsylvania as well, especially where the state environmental regulatory agency is so underfunded and under-staffed. <br />
PennFuture&rsquo;s comments made clear that we will not accept any repeal of the Clean Water Act protections that keep our waters, our economy, and our communities healthy.<br />
Background</p>

<p>Promulgated in 2015, the Clean Water Rule clarified the definition of &ldquo;waters of the United States&rdquo; under the federal Clean Water Act, and notably extended clean water protections for small, intermittent and ephemeral streams and wetlands that had a &ldquo;significant nexus&rdquo; to traditionally navigable waters.</p>

<p>The 2009 United States Supreme Court split decision in Rapanos v. United States, 547 U.S. 715 (2006) (&ldquo;Rapanos&rdquo;) left regulators and the regulated community confused about which waters fell under the Clean Water Act&rsquo;s jurisdiction because a majority of the Supreme Court did not agree on a definition of &ldquo;waters of the United States.&rdquo; The Clean Water Rule sought to clarify this confusion by adopting a definition of &ldquo;waters of the United States&rdquo; that was consistent with Supreme Court Justice Anthony Kennedy&rsquo;s opinion in Rapanos, which protected any waters that had a &ldquo;significant nexus&rdquo; to navigable streams.</p>

<p>In adopting the Clean Water Rule, EPA engaged in an almost 7-month public comment period, met with over 400 stakeholders, and received over one million comments on the proposed rule, with over 87% of them in favor of the agencies&rsquo; proposal. More than 50,000 Pennsylvanians supported the Clean Water Rule, including business owners, local officials, farmers, and health professionals.</p>

<p>PennFuture strongly supported the Clean Water Rule because it not only protected the larger streams used directly for drinking water by millions of Pennsylvanians -- it also protected sensitive headwater streams and wetlands that makeup thousands of miles of streams in the Commonwealth.</p>
",Environment,"Abigail M. Jones, Vice President of Legal and Policy"
Meet the Donor: Dawn Gorsline,9/26/2017,"<p>When Dawn and Brian Gorsline purchased property in Fairfield Township, they were overjoyed.</p>

<p>In 1999, Dawn and Brian were looking for property that would allow them to build a home to raise a family in a healthy and safe environment - a place where they could conserve land, grow Christmas trees and watch generations of their family experience the beauty of nature at its fullest.</p>

<p>Their search led them to an area in Fairfield Township, Lycoming County, zoned Residential-Agriculture. Dawn had grown up in the area and her family still lived there. &ldquo;It was the perfect place with the best people living in it,&quot; she said.</p>

<p>Little did she realize that several years after building her dream home, Dawn&rsquo;s desire to protect her family&rsquo;s way of life would involve her in a constitutional law case that would lead all the way to the Pennsylvania Supreme Court.</p>

<p>In 2013, a neighbor mentioned to Dawn that a company, Inflection Energy, was looking at locating a shale gas well pad near their homes, and that a township meeting had been scheduled.Dawn recalls the meeting. &ldquo;It was filled with angry people who had a lot of questions&quot; she said.It was at this meeting that she met one of PennFuture&rsquo;s legal team members, who, after studying the township&rsquo;s zoning ordinance, said, &ldquo;We have a case.&rdquo;</p>

<p>Because the township&rsquo;s ordinance did not expressly regulate oil and gas development, in order to allow shale gas development in its R-A district, the township had to find that use of the land for construction and operation of a well pad was &ldquo;similar to and compatible&rdquo; with other land uses expressly allowed in the district.Despite opposition from those most impacted by the well, the township&rsquo;s board of supervisors approved use of the land to construct and operate the well pad. Within 3,000 feet of the pad were 126 drinking wells. The owner of the property on which the well pad would be located lived in another township. PennFuture, representing the Gorslines and their neighbors, the Batkowskis, challenged the township&rsquo;s decision in Common Pleas Court.</p>

<p>Dawn and her neighbors quickly experienced the impacts associated with construction of a gas well pad in a residential neighborhood.Seismic &ldquo;thumper&rdquo; trucks showed up unexpectedly; strangers with chainsaws appeared in backyards without permission; helicopters hovered overhead and dropped cables across those same properties. It generally felt like life had gone from predictable to chaos in a few short months.</p>

<p>When Inflection began constructing a holding pond for the well pad despite the pending appeal, PennFutures legal team sprang into action and obtained an injunction to prevent further construction activities until the judge could rule on PennFuture&rsquo;s challenge.After deliberation, Judge Mark Lovvechio issued a decision in favor of the Gorslines and Batkowskis, reversing the township&rsquo;s conditional use application.Judge Lovvechio believed that Inflection had failed to show that the proposed land use was &ldquo;similar to and compatible with&quot; other land uses expressly allowed in the district.</p>

<p>Not to be outdone, Inflection appealed its loss to the Commonwealth Court.After written and oral argument, a three-judge panel of the Court reversed the Common Pleas Court&rsquo;s decision.The opinion was extraordinary in that the Court held that an industrial land use that uses heavy machinery, large diesel engines, and involves the storage of highly flammable material, toxic waste and explosives, and generates waste characterized as industrial by the state of Pennsylvania, was &ldquo;similar to and compatible with&rdquo; other land uses expressly allowed in the R-A district, such as single family homes.The ruling effectively cut an exception in the zoning ordinance so wide that it would result in shale gas development being allowed everywhere, regardless of the nature of the zoning district.It was an outrageous demonstration of judicial overreach.</p>

<p><strong>Not giving up, PennFuture sought allocator permission to have the case reviewed by the Pennsylvania Supreme Court. Only a small percentage of these types of petitions are granted by the Court, but this one of them.The case presents for decision the issues of whether shale gas development constitutes an industrial land use, and whether the government violates the constitutional rights of existing property owners who relied on the township&rsquo;s zoning scheme by allowing incompatible land uses in the zoning district in which the residents reside.The case was argued on March 8, 2017.The case has the potential to establish statewide precedent on a number of important environmental and public health issues facing Pennsylvania.</strong></p>

<p>Dawn feels strongly that clean air and clean water should never be threatened and that we - all of us - need to fight for our basic rights to protect those natural resources and public health and safety. Dawn teaches third grade and environmental science at her primary school and regularly emphasizes to her students that &ldquo;wherever you step, there is life where you walk. You cannot just abuse the land and expect good results.&quot;</p>
",Environment,"Susanne Whitehead, Director of Donor Relations"
PennFuture Celebrates New Poconos Location,9/25/2017,"<div>PennFuture clipped the ribbon of its newly opened office in the Northeast region of Pennsylvania on Sept. 21 with an open house event, inviting neighbors and fellow organizations to meet staff and supporters. Nestled in the heart of the Pocono Mountains, PennFuture is thrilled to have a new location in Mt. Pocono, Pa.</div>

<div></div>

<div>PennFuture holds a seat on the steering committee and also the state lead role for the Coalition for the Delaware River Watershed (CDRW), which makes the new location a perfect home among the high quality and exceptional value headwaters of this mighty river.</div>

<div></div>

<div>PennFuture&rsquo;s Northeast PA Outreach Coordinator, Emily Rinaldi, and PennFuture&rsquo;s Staff Attorney, Abby Jones, are the team members working in the new location.</div>

<ul>
	<li>Emily focuses on watershed protection and clean energy, serving as the state lead for the Coalition of the Delaware River Watershed. She also focuses on community and coalition outreach on stormwater management, environmental policy revolving around pipelines and natural gas drilling, and ways to reduce water pollution in the region. Emily joined PennFuture in October 2016.</li>
	<li>Abby&rsquo;s work focuses on water quality and watershed protection, stormwater management, and public land and open space protection. Abby joined PennFuture in March 2017.</li>
</ul>

<div>The open house provided a way for local nonprofits, fishing groups, donors, and the general public to have a chance to meet the staff and check out the new office space. It was delightful to see so many diverse groups present with about 30 people attending! These groups included Brodhead Watershed Association (our neighbors on Carlton Road), Trout Unlimited, PennFuture board members, and other local PennFuture supporters.</div>

<div></div>

<div>We ended the night with a few special words and introductions by PennFuture&rsquo;s Executive Vice President and Chief Operating Officer, Jacqui Bonomo, and PennFuture Board Member, Diana Dakey. The group enjoyed refreshments and lively discussion of environmental issues throughout the night.</div>

<div></div>

<div>If you did not get a chance to make the open house, but would like to become acquainted with the PennFuture staff, please feel free to stop by at 425 Carlton Road, Mt. Pocono, Pa.18344, Suite 101.</div>

<div></div>

<div>PennFuture would like to thank all who attended the open house!</div>
",Environment,"Emily Rinaldi, Northeast PA Outreach Coordinator, PennFuture"
Environmental Rights Amendment Forum Sparks Timely Conversation,9/25/2017,"<p>Nearly 200 citizens gathered on Sept. 14 at WHYY Studios in Philadelphia for PennFuture&rsquo;s &ldquo;Environmental Rights Amendment Forum.&rdquo; Attendees heard from legal experts, legislators, and current and former state officials who shared their perspectives on Article I, Section 27 of the Pennsylvania Constitution, an often-misunderstood provision commonly referred to as the &ldquo;Environmental Rights Amendment.&rdquo;</p>

<p>Article I, Section 27 states: &ldquo;The people have a right to clean air, pure water, and to the preservation of the natural, scenic, historic and esthetic values of the environment. Pennsylvanias public natural resources are the common property of all the people, including generations yet to come. As trustee of these resources, the Commonwealth shall conserve and maintain them for the benefit of all the people.&rdquo;</p>

<p>Over the course of the evening, Forum panelists stimulated thoughtful dialogue about what&rsquo;s at stake for Pennsylvania&rsquo;s citizens and illuminated for a general public audience what had been, for many that attended, an obscure legal issue. Forum panelists reflected on the historical context in which the Amendment emerged, explained relevant case law, discussed needed enforcement, and considered the future implications of the Amendment for Pennsylvania&rsquo;s citizens and environment.</p>

<p>The evening began with Franklin Kury, the former state legislator who conceived the Amendment in 1969 and helped shepherd it through enactment in 1971. Noting that the Amendment was a bi-partisan response to the environmental degradation scarring Pennsylvania as a result of unregulated industry, Kury expressed great satisfaction that, 46 years after enactment, the State Supreme Court, in its monumental PEDF decision this summer, finally read the plain language of the Amendment as originally intended, reinvigorating Article I, Section 27.</p>

<p>Next, John Dernbach, Professor of Environmental Law and Sustainability at Widener University, walked the audience through the text of the amendment. In a concise yet engaging PowerPoint presentation, Professor Dernbach explained the nuances of each of the Amendment&rsquo;s three sentences, and how courts have construed them since 1971, culminating in the recent PEDF decision.</p>

<p><a href=""https://pennfuture.org/Blog-Item-How-the-Environmental-Rights-Amendment-Strengthens-Our-Impact""><strong>A panel of expert environmental attorneys then discussed the meaning and substance of Amendment case law since 1971</strong></a>, such as Payne v. Kassab, Robinson Township v. Commonwealth, and Pennsylvania Environmental Defense Fund v. Commonwealth. The panel focused on why PEDF is so significant, explaining that the Court has now said that the state does not own our public natural resources as a proprietor, but instead manages them as would a bank that manages funds in a trust.</p>

<p>Both the history and legal panels provided an ideal segue for a bi-partisan panel of state legislators, who considered the Court&rsquo;s assertion that the state has an &ldquo;affirmative obligation&rdquo; to prohibit the degradation, diminution, and depletion of public natural resources in Pennsylvania. Specifically, they addressed the Court&rsquo;s assertion that the state must act via the legislature to protect the environment as well as why so many legislators, despite the PEDF decision, remain reluctant to do.</p>

<p>Finally, John Childe, the attorney in the PEDF case, and John Quigley, former Pennsylvania Department of Environmental Protection and Department of Conservation and Natural Resources Secretary, provided thoughtful insights about where we go from here. They asserted that, in the wake of PEDF, a new era of environmental legal victories may be near. To be sure, they, like all of the evening&rsquo;s panelists, elevated the conversation about a complex topic with a clarity and gravitas too often missing in public discussions about conservation and the environment.</p>

<p><em><strong><a href=""https://pennfuture.org/newsletter-sign-up"">Join PennFuture&rsquo;s email list</a> for updates about the latest news surrounding the Environmental Rights Amendment and upcoming events.</strong></em></p>
",Environment,"Jay Andrews, Ph.D, Director of Outreach"
Update: Finding PA's Solar Future Project Moves Forward,9/19/2017,"<p>The<a href=""http://www.dep.pa.gov/Business/Energy/OfficeofPollutionPrevention/SolarFuture/Pages/Finding-Pennsylvania%E2%80%99s-Solar-Future.aspx""><strong> Finding Pennsylvania&rsquo;s Solar Future project</strong></a> is a collaborative effort between the U.S. Department of Energy and the Pennsylvania Department of Environmental Protection. PennFuture is working closely with project partners and stakeholders to find a pathway to achieving 10 percent of our in-state generation from solar power by 2030.</p>

<p>On Sept. 14, we held our third stakeholder meeting at the Inn at Villanova in Radnor, PA. Among the 81 people who attend in person and 25 who participated through a webcast, we had representatives from the solar industry, electric utilities, government, academia, nonprofit groups, and consumers.</p>

<p>This meeting represented a transition. Our first two meetings put a lot of emphasis on the details of our scenario modeling and our projections for what markets will look like in the future. This session focused more on specific issues that were identified as &ldquo;pivotal factors&rdquo; for achieving 10 percent in-state solar generation by 2030.</p>

<p>Prior to this meeting, we held a webinar on alternative ratemaking where Karl Rabago, the  Executive Director of Pace Energy and Climate Center; Eric Miller of the Keystone Energy Efficiency Alliance; and Alan Cohn, Manager of Regulatory Strategy, at PECO discussed how different options for the rates we pay to electric utilities can impact the deployment of new technologies like solar.</p>

<p>At the in-person meeting, we had a panel discussion between Ethan Case of Cypress Creek Renewables and John McCawley of PECO Energy. This started the conversation on how solar generation will be split between large utility-scale installations and smaller distributed installations like rooftop solar systems. </p>

<p>While larger systems will continue to benefit from economies of scale and have lower installation costs in terms of dollars-per-watt, smaller distributed systems can still be cost-effective for consumers, are less subject to transmission losses, can help alleviate congestion, and can provide other benefits. </p>

<p>We also heard from our Keynote Speaker, Ken Schyuler of PJM, the Valley Forge based company that manages the electric grid for 13 states throughout the Midwest and mid-Atlantic and the District of Columbia.</p>

<p>As we move forward on our project, it will be critical that our pathways to increased solar generation consider the needs and the abilities of our power grid to provide reliable electricity throughout the region.</p>

<p>It&rsquo;s not too late to be part of the discussion. If you are interested in contributing, <a href=""http://www.dep.pa.gov/Business/Energy/OfficeofPollutionPrevention/SolarFuture/Pages/Finding-Pennsylvania%E2%80%99s-Solar-Future.aspx"">visit the website</a> or email the project partners at <a href=""mailto:RA-EPPASOLARFUTURE@pa.gov"">RA-EPPASOLARFUTURE@pa.gov</a>. </p>

<p>Our next stakeholder meeting will be held in Harrisburg on Dec. 7.</p>
",Environment,"Rob Altenburg, Senior Director for Energy and Climate"
