Blog Item Title,Schedule post date,Blog Full Text,Blog Category,Blog Authors
It's Time to Reimagine America's Infrastructure,7/29/2021,"<p>As Congress continues to push towards a potential infrastructure package, residents of the Queen Village neighborhood in Philadelphia were reminded just how desperately we need to reinvest in - and reinvent - <a href=""https://philadelphia.cbslocal.com/2021/07/25/queen-village-30-inch-water-main-break-flooding/"">our nation's crumbling infrastructure.</a> A 30-inch water main broke after midnight Sunday and flooded nearby streets, businesses, and homes, resulting in untold damages for residents in the area.</p><p>The City of Philadelphia confirmed that the broken cast iron pipe was originally installed in 1891. The Philadelphia Water Department <a href=""https://www.audacy.com/kywnewsradio/news/local/overnight-water-main-break-floods-homes-leaves-giant-hole"">said this</a>: ""Its one of our oldest in our system. We try to get as much life out of them as long as we can, obviously this one reached the end of its life and we're trying to deal with the situation right now.""</p><p>You'd be forgiven for thinking that this is an isolated incident involving an ancient pipe from the Gilded Age and moving on with your life. But, 15 percent of the city water mains <a href=""https://whyy.org/articles/like-an-asteroid-struck-bella-vista-residents-survey-damage-after-massive-water-main-break/?utm_campaign=sproutsocial&utm_content=1627321324&utm_medium=post&utm_source=twitter"">were installed before 1900</a>. It has been reported that Philadelphia has approximately 3,200 miles of pipe, which means that 480 miles of pipe were built at a time when horses were still the primary mode of transportation.</p><p>There is so much to admire about the built world that we were able to create through advances in technology and the sheer audacity of the human spirit. I am sure that there was a time when cast iron water main pipes were revolutionary. Now, towns and cities across America are squeezing the last life out of creaking and groaning infrastructure that cannot possibly be expected to deal with the challenges presented by climate change.</p><p>We are seeing the troubling signs of climate change across the globe: <a href=""https://www.nytimes.com/2021/07/26/world/asia/china-climate-change.html?action=click&module=Top%20Stories&pgtype=Homepage"">flooding in China</a>, heat and monsoons <a href=""https://www.nytimes.com/2021/07/26/world/asia/india-landslides-floods.html?action=click&module=Top%20Stories&pgtype=Homepage"">in India</a>, a tropical storm <a href=""https://www.reuters.com/world/asia-pacific/philippines-evacuates-thousands-monsoon-rains-flood-cities-provinces-2021-07-24/"">in the Philippines</a>, and heavy rainfall <a href=""https://www.nytimes.com/2021/07/15/world/europe/flooding-germany-belgium-switzerland-netherlands.html"">in Western Europe</a>. We are experiencing similar phenomena in America, too, as temperatures continue to rise and heavy rains continue to fall. We are also experiencing the damage done to our homes and businesses as our aged infrastructure struggles to keep pace with a harsher climate.</p><p>This weekend's water main break is only the latest indication that we risk far more by doing nothing than what we risk with a novel approach to rebuild our nation's infrastructure. Queen Village residents have called the scene ""apocalyptic"" and likened the latest sinkhole to an asteroid strike. This comes only months after <a href=""https://philadelphia.cbslocal.com/2021/02/16/cars-stranded-flooded-street-after-water-main-break-in-north-philadelphia/"">a 48-inch water main break in North Philadelphia</a> forced emergency responders to rescue nearly a dozen people by boat. Another water main break formed <a href=""https://philadelphia.cbslocal.com/2021/02/08/sinkhole-swallows-suv-after-12-inch-water-main-break-in-philadelphias-logan-neighborhood/"">a sinkhole that swallowed an SUV.</a></p><p>The current push to rebuild our nation's infrastructure also presents us with our best opportunity to reimagine our nation's infrastructure. If we are truly willing to invest trillions of dollars into building back better, then let's make sure we do just that. Philadelphia's water mains are bursting at the seams due to wear and tear, but it would be a mistake to focus on upgrading pipes that were built before Theodore Roosevelt became President. The best way to build back better is to chart a new course that does not rely on pipes and pavement.</p><p>The City of Philadelphia and the Philadelphia Water Department have been working to address its aging infrastructure for nearly ten years. Beginning in 2011, the city sought a new way to rebuild its stormwater infrastructure to better combat polluted runoff and the impact of heavy floods through green stormwater infrastructure (GSI). The Green City, Clean Waters program <a href=""/Blog-Item-Report-highlights-success-of-Philadelphias-Green-City-Clean-Waters-Program"">is a proven model for success</a> that represents truly fundamental change in the way we think of infrastructure in America. Prioritizing nature-based solutions that promote people over pavement allows municipalities to simultaneously increase preparedness for the impact of climate change and begin to address the harm caused to communities of color through decades of deliberate exclusion and disinvestment. GSI projects that incorporate green space like tree trenches and rain gardens provide relief to urban communities through reducing air temperatures and helping to <a href=""https://whyy.org/articles/isaias-emergency-eastwick-residents-call-for-city-state-aid-after-devastating-flooding/"">decrease the risk of flooding.</a></p><p>Cities across the world <a href=""https://www.cnn.com/2021/07/26/europe/london-flooding-infrastructure-climate-intl-cmd/index.html?utm_term=link&utm_source=twCNN&utm_content=2021-07-26T21%3A00%3A12&utm_medium=social"">are grappling with the grim reality</a> that they are not prepared for the impact of climate change. There are those in America who will tell us that we cannot afford to reimagine our nation's infrastructure. They will argue that American ingenuity cannot account for the weather. Senators will <a href=""https://www.bloomberg.com/news/articles/2021-07-26/infrastructure-talks-near-finish-as-senators-face-time-pressure"">balk at increased spending</a> to deal with the myriad issues plaguing our nation's water systems. We can choose to squeeze the very last drop of life out of pipes better left to a bygone age. We know what the consequences will be: swift-water rescues to save people from drowning in city streets, sinkholes swallowing SUVs, and millions in damages.</p><p>But American ingenuity did not die in 1981, 1891, or 1776. We only must choose to face this next great challenge with the same audacity and creativity that led us to create the built world that surrounds us. There are models like Philadelphia's Green City, Clean Waters program across the country. Municipalities and residents have been forced to go it alone for far too long. This moment demands federal action that prioritizes infrastructure that is cost-effective, sustainable, clean, and green.</p>",Climate; Community; Energy; Environment,"Adam Nagel, Campaign Manager"
Pennsylvania Supreme Court Rules that Drilling Revenues from State Forests Must be Used for Conservation,7/28/2021,"<p>Last week, the Pennsylvania Supreme Court <a href=""https://www.pacourts.us/assets/opinions/Supreme/out/J-78-2020mo - 104840407140939594.pdf?cb=1"">ruled that it is unconstitutional under the Environmental Rights Amendment (ERA)</a> for the General Assembly to transfer oil and gas lease funds designated for environmental conservation to the general fund for non-conservation purposes. This decision, appropriately dubbed ""PEDF IV,"" concludes a six-year legal battle between the Pennsylvania Environmental Defense Foundation (PEDF) and the Commonwealth.</p><p>The General Assembly established a lease fund in 1955 under the Lease Fund Act to receive ""all rents and royalties from oil and gas leases"" on Commonwealth land, and exclusively dedicated to environmental conservation purposes. The Department of Conservation and Natural Resource (DCNR) is charged with overseeing all oil and gas leases and contracts on these publicly owned lands, and all moneys in the fund are to be appropriated to the DCNR for carrying out the purpose of the fund.</p><p>From 1955 to 2008, the leases generated a total of $165 million. Then in 2009, the DCNR leased approximately 74,000 acres for Marcellus Shale drilling which generated close to $600 million. These revenues were made up of upfront bonus payments, annual rental fees, royalties for the marketable gas extracted, and interest penalties for late payments. Inspired by the large influx of revenue, the General Assembly added four new provisions to the Fiscal Code which essentially worked to restrict the allocation of lease fund monies to DCNR and redirect them to the general fund to help balance the state budget. This marked the start of the PEDF litigation.</p><p>In 2017, the Pennsylvania Supreme Court established in PEDF II that the ERA, Article I, Section 27 of the Pennsylvania Constitution, creates an express public trust subject to Pennsylvania private trust law with the purpose of conserving and maintaining the state's public natural resources ""for the benefit of all the people."" The ERA designates the Commonwealth as trustee, the people as the named beneficiaries, and Pennsylvania's public natural resources as the corpus (or body) of the trust.</p><p>PEDF II critically and clearly accepted the Pennsylvania Supreme Court's 2016 plurality's holding in Robinson Township v. Commonwealth, that this public trust imposes trustee obligations on the Commonwealth to (1) prohibit the degradation, diminution, and depletion of our public natural resources, whether these harms might result from direct state action or from the actions of private parties, and (2) the Commonwealth must act affirmatively via legislative action to protect the environment. It also rejected the previous three-part ERA test set forth in <em>Payne v. Kassab.</em></p><p>The PEDF II Court also ruled that two of the Fiscal Code provisions relating to oil and gas royalties (1602-E and 1603-E) were facially unconstitutional because they directed the royalties away from the trust corpus. Remember, the corpus under the ERA is Pennsylvania's public natural resources, and PEDF II had to figure out what to do if those natural resources are sold. According to Pennsylvania private trust law, revenue from the sale of trust assets constitute trust principle, and trust principle must remain part of the corpus of the trust. Royalties from the sale of oil and gas represent the sale of trust assets, and are therefore trust principle.</p><p>The Court then remanded the case back to the Commonwealth court to determine whether the other two provisions transferring money from the lease fund to the general fund (1604-E and 1605-E) were also unconstitutional. This required a determination of how the other revenues (the bonus payments, annual rental fees, and interest penalties) should be categorized under private trust law principles.</p><p>Taking a step back, typically in an oil and gas lease, the company pays several different payments for the lease/right to extract. The bonus payment is a one-time payment made by the company to secure the lease during a formal bidding process. The company then pays an annual rental fee to maintain its right to explore the area for oil and gas. Interest penalties are penalties related to late rental payments. Finally, the company pays royalties to the commonwealth based on the amount of marketable gas it extracts.</p><p>Under Pennsylvania private trust law, rental payments generated from trust assets are classified as trust income and can be distributed to trust beneficiaries. On remand in 2019, the Pennsylvania Commonwealth Court in PEDF III determined that the rents, bonuses, and interest penalties constitute income, and interpreted the ERA to recognize two distinct classes of beneficiaries: the current living citizens of Pennsylvania as life tenants and all future citizens as remaindermen. The court determined that since the ERA didn't specify how the proceeds should be allocated between successive beneficiaries (the life tenants and remaindermen) the trust laws from when the ERA was adopted (the 1947 Principle Income Act) would govern, thereby directing the income to go to the life tenants. This led the court to conclude that the transfer of revenue to the general fund was constitutional as it represented income distributed to the trust's life tenants. PEDF then appealed to the Pennsylvania Supreme Court.</p><p>Last week's decision reversed PEDF III on the grounds that the ERA does not in fact establish successive trust beneficiaries, and therefore the 1947 trust laws concerning apportionment among successive beneficiaries do not apply. The Commonwealth Court in PEDF III interpreted the phrase ""for the benefit of all the people"" in the ERA in isolation to mean that allocating the trust income to the general budget would benefit all the people, and would therefore be permissible.</p><p>In discussing the ERA, the Court explained that ""[t]he text does not distinguish between 'current Pennsylvanians' and future generations. Instead, generations yet to come are included within the broadly defined beneficiary: 'all the people.'"" And as the Court in PEDF II explained, ""The Commonwealth's fiduciary duty to ""conserve and maintain"" our public natural resources is a duty owed to the beneficiaries of the public trust, namely ""the people, including generations yet to come,"" as set forth in the second sentence of Section 27."" This essentially means that the Commonwealth, as the trustee, cannot distinguish or prioritize the needs of current Pennsylvanians and future Pennsylvanians by spending trust income on general budgetary matters because ""the ERA created simultaneous beneficiaries with equal interests in the trust's management.""</p><p>Public trusts for natural resources are not a novel concept, and they exist in every state through either constitutional provisions, statutes, or common law (i.e., court decisions) to protect an area's natural resources for the benefit of the present and future public. However, current public trust law for natural resources is vary sparse and lawyers and the courts will often draw on private trust law to help answer questions that arise that are not answered by public trust law - as was done in the PEDF line of cases.</p><p>While there are no binding rules on the type of trust law that should be used to fill these gaps, some legal professionals <a href=""https://repository.law.umich.edu/cgi/viewcontent.cgi?article=2516&context=mjlr"">have strong opinions on how to apply private trust principles</a> to public trusts so as to uphold the intent and purpose of the public trust. Professor John Dernbach, for example, stresses that the income maximization aspects of private trust law should not be used to define the duties and limits of a public trustee as they are incompatible with the purpose of public trusts for natural resources.</p><p>We have also seen recently how these principals can be perverted into an argument in favor of depleting Pennsylvania's natural resources. Pennsylvania State Senators Gene Yaw and Lisa Baker (joined by the Pennsylvania Republican Caucus and several municipalities) <a href=""/News-Environmental-Groups-Law-Center-File-Friend-of-Court-Brief-in-Opposition-to-Challenge-to-Delaware-River-Basin-Commission-Fracking-Ban"">attempted to challenge a ban on fracking</a> within the Delaware River Basin passed by the Delaware River Basin Commission (DRBC) by essentially arguing that they have public trust duties under section 27 of the ERA as individual legislators to exploit the State's natural resources for economic gain. They argued that the fracking ban harms the Commonwealth and its citizens by ""interfering with the reasonable investment-backed expectations of landowners,"" and diminishing the property value of land in the Basin.</p><p><a href=""/Blog-Item-Federal-Court-Dismissed-Lawsuit-Challenging-DRBCs-Ban-on-Fracking"">In an unsurprising victory</a>, the District Court <a href=""/Files/Admin/Opinion-on-Dismissing-Yaw-Suit.pdf"">rejected these arguments</a> on the basis that the two senators are not ERA trustees and have no standing to bring the complaint. Arguments like the one brought by Senators Yaw and Baker which grossly misinterpret the ERA are why it is so important to remain diligent in ensuring that the ERA is used to its fullest and most correct purpose to <a href=""https://www.legis.state.pa.us/cfdocs/legis/LI/consCheck.cfm?txtType=HTM&ttl=00&div=0&chpt=1&sctn=27&subsctn=0"">""protect our rights to clean air, water, and the preservation of the natural, scenic, historic and esthetic values of the environment.""</a></p>",Climate; Community; Energy; Environment,"Emily Rollins, Legal Intern"
Maineâ€™s Innovative Response to Plastics Pollution and What the Rest of Us Can Learn From it,7/27/2021,"<p>China remains the world's largest producer of plastic, but<a href=""https://www.smithsonianmag.com/smart-news/us-worlds-number-one-source-plastic-waste-180976214/"">research has shown that the United States</a> was the world's number one source of plastic waste as of 2016, pushing 42 million metric tons into the environment. Americans also use more plastic per capita than any other country on the planet at roughly 286 pounds per person.</p><p>Because the U.S. lacks the waste management infrastructure to recycle all its plastic waste, the country transports about half of its recyclable materials to other countries. However, this has been complicated by <a href=""https://www.dw.com/en/amid-plastic-deluge-southeast-asia-refuses-western-waste/a-49467769"">China's 2018 announcement to stop the importation</a> of plastic waste, followed by announcements by other Southeast Asian states such as Thailand in 2021, Vietnam by 2025, India, and even Turkey. Clearly, something must be done to tackle our plastic waste problem in the U.S., and states like Maine might be leading the way and teaching us all a thing or two about finally solving this issue.</p><p>According to a 2018 study cited by the Environmental Protection Agency, containers and packaging (namely ""bags, sacks and wraps; other packaging; polyethylene terephthalate (PET) bottles and jars; high-density polyethylene (HDPE) natural bottles; and other containers"") <a href=""https://www.epa.gov/facts-and-figures-about-materials-waste-and-recycling/plastics-material-specific-data"">rankas the most used plastic in the U.S.</a> at over 14.5 million tons.</p><p>For the past thirty years, U.S. states have begun to pass individual statewide legislation to curb the usage of plastic bags. In 1991, <a href=""https://www.ncsl.org/research/environment-and-natural-resources/plastic-bag-legislation.aspx"">Maine became the first state to enact legislation</a> requiring recycling efforts at retail stores. The law prevents retailers from supplying plastic bags unless they provide a convenient storefront receptacle to ensure used bags are collected and recycled. Since then at least four other states-California, Delaware, New York and Rhode Island-and the District of Columbia have followed their lead.</p><p>However, as we have previously noted <a href=""/Blog-Item-Recycling-is-exacerbating-the-plastic-waste-crisis"">in our PennFuture Blog</a>, plastic recycling by the consumer alone will not solve the plastics pollution crisis our global environment is facing, <a href=""https://www.nationalgeographic.com/science/article/plastic-produced-recycling-waste-ocean-trash-debris-environment"">as just 9 percent of global plastic waste</a> is recycled. PennFuture has previously argued that the world must transition away from plastic packaging altogether. As of this writing, eight states-California, Connecticut, Delaware, Hawaii, Maine, New York, Oregon and Vermont-<a href=""https://www.ncsl.org/research/environment-and-natural-resources/plastic-bag-legislation.aspx"">have banned single-use plastic bags.</a></p><p>Arguably, a major step towards the total elimination of plastic packaging can be seen in Maine's new extended producer responsibility (EPR) policy for packaging which makes it all the more costly for companies to use plastic packaging, among other types as well.</p><p>Maine's new EPR law begins to shift the burden on recycling from the consumer to the producer by requiring producers <a href=""https://www.nytimes.com/2021/07/21/climate/maine-recycling-law-EPR.html"">to cover 100 percent of its municipalities' recycling costs.</a> Maine's Department of Environmental Protection<a href=""https://www.fastcompany.com/90655072/maine-companies-will-now-have-to-pay-to-help-fix-the-broken-recycling-system?utm_source=postup&utm_medium=email&utm_campaign=world-changing-ideas&position=9&partner=newsletter&campaign_date=07172021"">will set fees for different types of packaging</a>. Companies will be charged on the amount of packaging waste they create in the state, with higher fees charged for materials that are more difficult to recycle. The fees will drop when companies redesign and replace old packaging for more recyclable ones, or increase the amount of recycled content in their packaging. This eco-modulation system ""incentivizes less packaging and better packaging"" <a href=""https://www.wastedive.com/news/extended-producer-responsibility-packaging-maine-oregon/602479/"">according to State Rep. Nicole Grohoski</a>, one of the bill's primary sponsors.</p><p>Maine's DEP will partner with a ""packing stewardship"" organization that will run the program and will offer companies assistance in designing packaging that better fits the system. The organization will need to report data such as tonnage of packaging collected and provide funding for infrastructure and education improvements.</p><p>While 33 states currently have EPR laws, <a href=""https://www.nytimes.com/2021/07/21/climate/maine-recycling-law-EPR.html"">they are far more narrow</a>; typically focusing on specific products like used mattresses and tubs of paint. Even in this narrow application, Connecticut's mattress, paint, electronic and thermostat EPR programs have diverted more than 26 million pounds of waste since 2008, <a href=""https://www.productstewardship.us/news/328753/Extended-Producer-Responsibility-Programs-Proven-Successful-in-Connecticut.htm"">according to one study.</a></p><p>Packaging-centric EPR policies have achieved success worldwide as well. <a href=""https://www.nytimes.com/2021/07/21/climate/maine-recycling-law-EPR.html"">In Quebec, Canada</a>, a similar program <a href=""https://www.prnewswire.com/news-releases/kruger-packaging-invests-250-million-in-the-trois-rivieres-mill-527461141.html"">results in $250 million sent back to communities</a> for recycling purposes each year. Around 63% of packaging <a href=""https://www.clf.org/blog/recycling-reform-producer-responsibility-maine-pollution/"">is recycled in Quebec</a>, versus an average of 25% in the U.S. A study by the Oregon Department of Environmental Quality of Canadian EPR programs found that consumer product prices had increased <a href=""https://www.nytimes.com/2021/01/27/arts/design/recycling-packaging-new-york.html"">by only $0.0056 per item.</a></p><p>Plastic pollution is undoubtedly an issue in Pennsylvania. Studies have estimated that by 2050 there will be more plastic in our oceans than fish. On average, in a single year, <a href=""https://environmentamerica.org/reports/pac/microplastics-pennsylvania"">the Philadelphia Water Department removes 44 tons</a> of trash from a 32 mile stretch of the Schuylkill and Delaware rivers, 56% of which was plastic waste, according to a PennEnvironment report. In Pennsylvania, plastic is the most common form of visible litter. In fact, the Department of Transportation spends over $13 million every year cleaning up just roadside litter. The problem is so widespread that nine of the largest cities in Pennsylvania spend over $68.5 million every year on litter and illegal dumping, with $46.7 million of that going toward litter abatement.</p><p>Pennsylvanias very low cost in sending trash to landfills and incinerators <a href=""https://www.casey.senate.gov/news/releases/casey-introduces-legislation-to-restrict-flow-of-trash-into-pa-from-other-states"">places Pennsylvania as among the largest importers</a> of out-of-state waste in the nation. At the same time, Pennsylvania's Department of Environmental Protection, facing cuts in their funding by the legislature, <a href=""https://wjactv.com/news/local/dep-cancels-statewide-recycling-implementation-grants-for-first-time-in-33-years"">has cut grant funding</a> for the state's recycling program in 2021.</p><p>With the plastics pollution issue increasing in Pennsylvania in the face of cuts to traditional recycling programs, it is time to change course. Maine has shown us that legislators can stand up to the plastics manufacturers and larger petrochemical industry and force them to take responsibility for the plastic pollution they are putting into the marketplace, and by extension, the environment at virtually no cost to the consumer.</p>",Climate; Community; Energy; Environment,"John Ukenye, Policy Analyst"
