Blog Item Title,Schedule post date,Blog Full Text,Blog Category,Blog Authors
Looking Ahead to the Best and Worst of 2022â€™s Legislative Proposals,12/30/2021,"<p>At a time of unprecedented environmental, economic and public health concerns, now is a time when Pennsylvania's legislators should be developing common-sense solutions.</p><p>The General Assembly is unfortunately not known for being the most solutions-oriented of the country's legislative bodies. That said, the most recent legislative session does give us some reason for optimism in 2022.</p><p>Here is our roundup of the best - and the worst - of the bills expected to make their way through the Pennsylvania General Assembly in 2022.</p><p><strong><u>The Good</u></strong></p><ul><li>Clean Water Funding</li></ul><p>With thousands of miles of impaired waterways flowing across the state, it is imperative that Pennsylvania dedicates more funding toward conservation, pollution remediation, and agricultural best practices. The American Rescue Plan offers a rare chance to do just that, providing potentially millions of dollars in untapped funding.</p><p>But first the General Assembly needs to enable state agencies to use ARP funds toward clean-water projects. SB 525 would create a Growing Greener III program and infuse $500 million from ARP funds. Separately, HB 1901 proposes a new Clean Streams Fund that would dedicate resources to improve water quality by reducing agricultural runoff, acid mine drainage, and stormwater pollution across the state. HB 1901 would allocate an additional $250 million in ARP funds.</p><p>With the Farm Bureau showing their support, we may finally have a funding mechanism to address our water pollution challenges.</p><ul><li>Clean Energy Progress</li></ul><p>For years, PennFuture has championed legislation that would allow building occupants - including those who are not property owners or who lack roof access - to benefit from solar energy. Community solar legislation (SB472 and HB1555) may finally have its day in the sun.</p><p>Additionally, legislation is progressing to enable changes to a voluntary clean energy financing tool, known as Property Assessed Clean Energy (PACE). The update may allow for counties to amend their current programs to expand the financing tool's eligibility to include multi-family buildings (HB1760).</p><ul><li>Environmental Justice</li></ul><p>When Pennsylvania participates in its first emissions-allowance auction as part of the Regional Greenhouse Gas Initiative (RGGI), millions of dollars of funding will be made available for clean energy and clean air projects.</p><p>SB 15 and HB 1565 proposes to spend those proceeds on programs that would support workers and communities affected by the clean energy transition, investing specifically in frontline and environmental justice communities.</p><p>Without this legislation, the Department of Environmental Protection (DEP)is limited by law in how it can spend auction proceeds. That leaves the door open for the General Assembly to siphon or otherwise divert proceeds to causes or programs that would not benefit frontline workers, communities, or our shared environment.</p><p><strong><u>The Bad</u></strong></p><ul><li>RGGI Drama</li></ul><p>Pennsylvania's long journey toward joining RGGI may soon come to pass - but not without more desperate flailing from the state's elected officials. The Legislative Reference Bureau refused to publish DEP's final CO2 Budget Trading Rule until after the House completed a resolution to disapprove the rule. Resolution SCRRR1 passed by a vote of 130-70 in December. Fortunately that's short of being veto proof. After Governor Tom Wolf issues his veto, the path to joining the emission-trading program will finally be clear.</p><ul><li>Ban on Natural Gas Bans</li></ul><p>Across the country, gas utilities are responding with fear to the growing number of restrictions on gas connections. Consistent with efforts to rapidly decarbonize, cities such as New York and San Francisco have placed limits on gas hookups in new construction homes and businesses. But rather than find creative strategies to reduce greenhouse gas emissions from Pennsylavanians' natural gas use, HB 1947 and SB 275 would simply prevent individual municipalities from developing their own policies. This ""energy choice"" legislation is not only bad climate policy, it's totally inconsistent with claims that the General Assembly values the independence of local municipalities to develop their own regulations.</p><ul><li>Undermining Spill Reporting Tools</li></ul><p>Pipeline accidents, fuel tanker spills, and other environmental catastrophes remain regular occurrences. Despite the need to better enforce existing clean water protections, HB 1842 allows polluters to pollute more, without notifying anyone or without consequence. The legislation would egregiously take away our rights to know when a spill or discharge is impacting public health and local businesses. It jettisons spill reporting requirements from the experts at the Pennsylvania Fish and Boat Commission (PFBC) and DEP, leaving our waters unprotected and with our communities, families, and businesses uninformed of the risks.</p><p>PennFuture will continue to monitor the legislative actions coming from the General Assembly - the good as well as the disastrous. Stay engaged for action alerts so you can help make sure our legislators act in the best interests of Pennsylvania's natural environment and our most-vulnerable communities.</p>",Climate; Community; Energy; Environment,"Ezra P. Thrush, Senior Director of Government Affairs"
"Goodbye 2021, Hello 2022",12/28/2021,"<p>When I was a kid, my gang of cousins and I did this thing we called Goodbye School, Hello Summer. An uncle supervised the building of a little bonfire, and in it we burned our books, notebooks and worksheets, and then roasted potatoes in the embers. Good memories, even better potatoes.</p><p>It's a comforting recollection of times when taking stock of what was, and what might be, was simpler. As kids growing up in the anthracite region, tossing into a fire the unpleasant, to clear the way for the days of summer, then start all over a few months later and hoping for a better result the next time around, wasn't the worst of our ideas.</p><p>But here we are, all grown, another year wrapping up and a new one only days away. We're trying to reconcile the current year into a new one. What are the take-aways from 2021, what are the threads that will carry us into 2022, and what might we expect from a new year to the extent we can predict anything?</p><p>I can't identify a bigger cause for vigilance and action than the threats to our democracy that have remained a constant through 2020 into 2021. Yes, PennFuture's mission is an environmental one, but our theory of change relies on having a bipartisan, pro-environment legislature. Our current legislature is far from that benchmark.</p><p>Attacks on our democracy haven't let up in the past year, and certainly not in the realm PennFuture so often focuses our gaze upon - the state legislature. The same players working to erode our democracy are attacking environmental laws, climate proposals and regulatory programs - constantly. The entrenchment of its tribes, unholy alliances with industry, and vastly different opinions about what is best for Pennsylvanians is a discordant and constant thrum that has run through year one of the current two-year legislative session.</p><p>The upcoming 2022 elections and how Pennsylvanians intend to conduct our elections will bring the differences and discord into even sharper focus. As the state legislature approaches the soundness of our democracy, so will go our futures, and prospects for addressing the climate crisis. </p><p>So in 2022 we must be prepared for harder threats to our democracy. We need to be prepared for amped-up attempts to stymy voting through discriminatory practices, and more barriers to creating fairer state and federal legislative district maps. </p><p>Through PennFuture's strategic work in the civic engagement and democracy arena, we are ready to do our part.<a href=""/democracyforall"">Democracy for All PennFuture</a> is a program that registers voters, does civics education and increases voter turnout. Democracy for All is aimed at under-represented demographics including communities of color, single women and young voters, groups where there are gaps between eligibility to vote and actual registrations. Working as part of PA Voice, a statewide table that coordinates efforts of organizations doing similar work, we will build upon PennFuture's program in the Lehigh Valley, expand to Allegheny County, and hopefully establish a presence in Lackawanna and Luzerne Counties, two counties that have been chronically underserved with deep legacies of environmental injustices.</p><p>Our strategic partner Conservation Voters of PA will also be engaging voters in the Philadelphia collar counties and the Poconos.Our democracy must hold together as we go to polls to elect a new governor in 2022. Redistricting should grab the attention of voters everywhere. Geographies of representation will shift, and voters have important decisions to make about who will represent them and their communities in Harrisburg and Washington.</p><p>There is cause for guarded optimism for new laws to restore and protect water quality in 2022. There is overdue bipartisan support for several of PennFuture's legislative priorities including the creation of a Clean Water Fund, and <a href=""https://www.legis.state.pa.us/cfdocs/billinfo/billinfo.cfm?syear=2021&sind=0&body=S&type=B&bn=251"">programs to educate and limit fertilizer application</a>. In a very exciting development, the reauthorization of a <a href=""https://www.legis.state.pa.us/cfdocs/billinfo/billinfo.cfm?syear=2021&sind=0&body=S&type=B&bn=525"">Growing Greener-like programis looking good</a>. This will enable investments in many of the sectors and priorities named by PennFuture in our <a href=""/greenstimulus"">Green Stimulus and Economic Recovery Platform for PA</a>. If support for these proposals remains on track, there will be cause for celebration, not only for the environment, but for the bi-partisanship that will have made these wins possible.</p><p>As we enter 2022, there is justifiable concern for the fate of what has been PennFuture's climate priority since October 2019-Pennsylvania's enrollment in the Regional Greenhouse Gas Initiative (RGGI), and the resulting reductions of climate-killing emissions in our power sector. Anti-environmental legislators have fought vigorously to kill what was directed by <a href=""https://www.governor.pa.gov/newsroom/governor-wolf-takes-executive-action-to-combat-climate-change-carbon-emissions/"">Governor Wolf's executive order</a> to move us into RGGI.There is the possibility for the program to be implemented in early 2022, but the fights will move into the courts, where PennFuture will work to defend this important program.</p><p>As an organization, PennFuture is a vital team of watchdogs, defenders, and organizers who care deeply about our state, its communities and environment. This upcoming 2022 is as important a New Year as ever. We are working hard toward our mission and need all of you by our side doing the same. We have been encouraged by the sustainable measures included in President Biden's priorities, and we're are all aware of how wrought and complicated the politics of advancing these pro-climate measures have been and will continue to be. We must all stay engaged on the state, federal and local levels. So as we wrap the year, I hope you all find some precious time for respite and re-charge for the big year ahead.</p><p>Thank you for being part of PennFuture.</p>",Climate; Community; Energy; Environment,"Jacquelyn Bonomo, PennFuture President and CEO"
PennFuture Meets with State Agencies About Asphalt-Plastic Mixture,12/20/2021,"<p>On Thursday, December 9, 2021, PennFuture met with representatives from the Departments of Transportation (PennDOT), Conservation and Natural Resources (DCNR), Environmental Protection (DEP), and General Services (DGS), Pennsylvania GreenGov Council, and engineering firm RK&K.</p><p>The purpose of this meeting was to gather more information <a href=""https://www.govtech.com/fs/pa-to-pave-road-with-asphalt-recycled-plastic-mixture"">regarding a pilot program announced in October</a> to pave a portion of a Ridley Creek State Park roadway in Delaware Countywith an asphalt and recycled plastic mixture. We stated our support for innovative ways to reduce single-use plastic trash in our environment, and our willingness to learn more about the pilot project, their plans for testing and evaluation over their stated five-year period, any additional pilot projects they may be considering, while also expressing PennFuture's water quality concerns regarding microplastic pollution.</p><p>Since the initial letter requesting a meeting was sent, it was announced in November that Shell would be paving <a href=""https://www.timesonline.com/story/news/2021/11/12/shell-partners-recycling-company-pave-roads/8588093002/"">nearly six miles of their Beaver County site</a> with an asphalt and plastic mixture. We inquired further about this project as well.</p><p>DCNR, DEP, and the other agencies present stressed their desire to seek innovative ways to reduce plastic pollution in our Commonwealth.</p><p>The plastic modified asphalt mixture used in the pilot program is being evaluated by PennDOT's laboratory, where ongoing controlled testing is being conducted. Early laboratory testing exhibits no microplastics released from the asphalt mixtures containing the recycled plastic modifier. Field tests will be conducted two times a year for three years (and then annually for the next two years), specifically to study the effect of natural wear-and-tear on the roadway, and will assess whether microplastics are detected in rainwater runoff from the test and conventional asphalt roadway sections. As part of ongoing research led by PennDOT, they anticipate engaging in more pilot projects utilizing similar asphalt modifiers or other recycled materials products to support the Commonwealth's move to more sustainable policies and infrastructure.<br /><br /> PennDOT also noted that asphalt modifiers are not uncommon, especially when incorporating asphalt millings [commonly known as recycled asphalt pavement (RAP)] in new asphalt mixtures. PennDOT emphasized that DOTs extend the life cycle of asphalt by utilizing modifiers manufactured with polymers from virgin sources. In the case of the plastic modified asphalt mixture used in this pilot program, the agencies note that the plastic component is a 2% additive of the binder that comprises approximately 5% of the overall asphalt mixture - which results in a very minimal amount of plastic present. Yet, this quantity of plastic adds stiffening but does not compromise the required flexibility of the pavement; too stiff, and the asphalt can crack while too much flexibility results in the formation of ruts. According to the representatives present, laboratory and field trials undertaken in other states indicate that plastic concentrations above 5% may risk increased cracking. The agencies claim that the release of microplastics seems highly unlikely because the modifier, which can be in a paste, wax, or pellet form, is melted and homogenized as an inseparable binder mixture during the formulation of the asphalt at the plant; however, they are committed to undertaking the studies discussed above.</p><p>In regards to the Shell asphalt-plastic mixture project, the agencies present stated that there is little oversight in regards to private projects such as this one. Many contractors do follow PennDOT asphalt specification, but PennDOT does not have a say on private roads. DEP, however, can choose to monitor the environmental impact of these private roads. DEP stated that they do not have plans to monitor the Shell road project at this time. In response to PennFuture's concerns about this use of post-consumer plastic modifiers creating more microplastic water pollution, one of the representatives said that <a href=""https://greenmantra.com/the-plastic-road-ahead/"">Green Mantra</a>, the organization behind Shell's mixture, has stated their lab tests showed that nothing was identified as plastic one the asphalt and plastic were mixed.</p><p>Microplastic contamination is a prevailing issue worldwide, including in Pennsylvania. PennEnvironment <a href=""https://pennenvironment.org/reports/pac/microplastics-pennsylvania"">sampled over 50 of Pennsylvania's rivers</a>, lakes, and streams and found microplastics in 100% of those samples -- with the subsequent report stating that humans are consuming roughly a credit card's worth of plastic every week.</p><p>We appreciate the agencies' willingness to meet with us and offer more clarity in regards to the pilot program. While the agencies expressed their comfort with the use of post-consumer plastic in asphalt mixtures not increasing microplastic pollution in our waters, PennFuture still has concerns regarding the long-term environmental impacts of the asphalt-plastic mixture. We will continue to monitor projects like this that could add to the alarming presence of microplastics in Pennsylvanias waters.</p>",Community; Energy; Environment,"John Ukenye, Policy Analyst"
Renewable Natural Gas: Hope or Hype?,12/16/2021,"<p>""Renewable natural gas"" (RNG) sounds good, but does it live up to the hype as a green alternative to fracked gas or is it something like the mythical ""clean coal""- <a href=""https://www.huffpost.com/entry/ad-firm-behind-clean-coal_b_210086"">an invention of a high-powered advertising agency hired</a> by a coal-industry front group? Like many things, the reality is a little more complicated than labels like ""clean"" or ""green.""</p><p>Fracked gas is a fossil fuel. It's made up primarily of methane (CH4) that was formed hundreds of millions of years ago from the decay of plant and animal waste and has been trapped deep underground ever since. Rather than leaving it undisturbed, we drill and frack to bring it to the surface where it either leakes into the atmosphere or is burned releasing carbon dioxide (CO2). In either case, it's pollution directly contributes to the climate crisis.</p><p>There is another fuel called ""biogas"" which isn't a fossil fuel-it is formed from decaying waste in landfills, sewage plants, or livestock farms. Instead of releasing long buried pollutants, biogas is part of a carbon cycle where plants and animals take up carbon and then release it as waste a relatively short time later. This at least raises the possibility of having fuel use result in no net increase in carbon pollution.</p><p>While replacing fracked gas with biogas seems like an obvious solution, it doesn't always work. Biogas has a much lower methane content and can contain much more CO2 along with many other chemicals. It isn't the drop-in replacement we would like. That is where RNG comes in-it is biogas that has been refined to be a better substitute for fracked gas.</p><p>So, is substituting RNG for fracked gas the solution we are looking for? There is a temptation to compare RNG to fracked gas in isolation and conclude burning a biofuel is better than burning a fossil fuel. Unfortunately, that is answering the wrong question.</p><p>A lower-emitting version of fracked gas may be a useful tool in our toolbox, but that isn't the ultimate goal. Our actual focus needs to be on the transition to a sustainable energy economy that gets us to net-zero carbon as rapidly as possible. This requires looking at the big picture and asking how RNG fits in our broader energy and environmental systems. It also requires looking at the specific sources of RNG and deciding if using it makes sense.</p><p>For example, one possible source for RNG is from manure produced at a concentrated animal feeding operations (CAFOs). These are industrial operations that raise far more livestock than a farm could naturally manage and, in the process, release huge amounts of pollution to our air and water.Having RNG as a marketable product makes CAFOs more profitable-effectively subsidizing more pollution.</p><p>Some may argue that capturing the methane from CAFOs and creating RNG is a better solution than releasing it into the atmosphere, but that is a false choice.Before we get to that point, we should recognize that CAFOs themselves are the result of policy choices that incentivise industrial agriculture operations at the expense of more sustainable farms.In a well designed system using more traditional farming practices, waste products can be fertilizer rather than being diverted for fuel.</p><p>There are similar issues on the demand side as well.Taking a narrow view one could argue that RNG is a better option for heating, cooking, and other fossil fuel uses.Looking at the big picture we can ask if the fuel use is necessary in the first place.Investments in energy efficiency can be a highly cost-effective way to reduce demand and electrification makes it possible to replace fuel use with clean and renewable energy like wind and solar.</p><p>RNG may have a role in a clean energy future, but at best it will be a supporting actor. We don't have the capacity to make anywhere near enough RNG to displace the current demand for fracked gas, and what we can produce is significantly more expensive.That means that we have to think carefully about where it makes sense to use it.</p><p>Also, RNG production is, at its core, a refinery operation.Even if it can be done in a way that is carbon neutral, there are still potential impacts on the environment and especially on neighboring communities. It might have a role in decarbonizing industrial applications that need methane as a feedstock, rely on combustion as part of the process, or for some other reason can't effectively be electrified, but it's not a panacea.</p><p>For all its potential uses, there are some serious risks.The pipe-dream of RNG ""solving the climate crisis"" could easily become a convenient excuse or justification to build and maintain fossil fuel infrastructure.Doing so will lock in reliance on the fracked gas industry and other unsustainable business practices for years to come.</p><p>Going forward we need to look at the big picture and prioritize our investments in the technologies and systems that we truly need.</p>",Climate; Energy; Environment,"Rob Altenburg, Senior Director for Energy and Climate"
