Blog Item Title,Schedule post date,Blog Full Text,Blog Category,Blog Authors
Federal Court Dismissed Lawsuit Challenging DRBCâ€™s Ban on Fracking,6/24/2021,"<p>We continue to bring you good news on the fracking front in the Delaware River Basin. In February 2021, the Delaware River Basin Commission (DRBC) took the <a href=""/Blog-Item-Fracking-Banned-in-Delaware-River-Basin"">monumental step in passing regulations</a> that ban the use of high volume hydraulic fracturing technology (""fracking"") to extract shale gas within the Delaware River Basin.</p><p>As predicted, a legal challenge was quickly filed challenging the DRBC's authority to ban fracking, spearheaded by PA State Senators Gene Yaw and Lisa Baker, the PA Senate Republican Caucus, and several municipalities. PennFuture, joined by partners, responded by submitting a <a href=""/News-Environmental-Groups-Law-Center-File-Friend-of-Court-Brief-in-Opposition-to-Challenge-to-Delaware-River-Basin-Commission-Fracking-Ban"">""friend of the court"" brief</a> which focused on the erroneous Environmental Rights Amendment claims made by the plaintiffs. (Article I, Section 27 of the Pennsylvania Constitution recognizes a fundamental public right to clean air, pure water, and to the preservation of the natural, scenic, historic and esthetic values of the environment and to have the Commonwealth conserve and maintain public natural resources for the benefit of present and future generations.) Our brief supported the arguments of the DRBC and intervenors that the plaintiffs lacked standing to bring this lawsuit.</p><p>On June 11, 2021, the District Court for the Eastern District of PA <a href=""/Files/Admin/Opinion-on-Dismissing-Yaw-Suit.pdf"">agreed and dismissed the case</a> holding that the plaintiffs lacked standing to file this case. Standing is the legal concept that ensures that a party has a ""dog in the fight"" - basically have they suffered the right kind of redressable injury to bring the lawsuit and ""stand"" before the court. Ultimately, Judge Paul S. Diamond concluded that this dispute ""is primarily partisan and is best resolved through the political process.""</p><p>In particular, Judge Diamond disagreed with the Senators' claims that state law vests them with sufficient interest to confer standing as does their claimed status as ""trustees"" under the Environmental Rights Amendment, calling these theories ""meritless."" The plaintiffs failed to show that the DRBC's actions harmed them: ""Although all plaintiffs argue vigorously that they have standing, they do not."" However, while foreclosed to the Senate plaintiffs, the court left open the possibility for the municipal plaintiffs to refile with strengthened allegations. The plaintiffs have 30 days to appeal this decision if they so choose.</p><p>The fact that DRBC's ban on fracking survived its first legal challenge is definitely cause for celebration! We have been waiting <a href=""/Blog-Item-Moratorium-on-Fracking-in-the-Delaware-River-Basin-is-Critical-to-Protect-Our-Water"">for over a decade for the DRBC's ban</a> to become permanent and we believe the final ban will withstand any challenges.</p><p>But challenges to DRBC's authority over fracking still remain. Not only could the municipal plaintiffs refile this case and the parties can also appeal the decision, but there is an outstanding 2016 lawsuit against DRBC filed by the Wayne Land and Mineral Group. That case challenges DRBC's authority under the Delaware River Basin Compact to regulate shale gas development in the Basin as a ""project."" The impact of both the finalization of the DRBC's fracking ban regulations and the recent decision in Yaw v. DRBC is still being considered.</p><p>Additionally, the DRBC withdrew its proposed regulations on transport, storage, treatment, and disposal of fracking wastewater within the Basin and its proposed regulations on allowing Delaware River Basin water to be exported outside of the basin to be used in fracking operations. PennFuture took issue with their <a href=""/Blog-Item-Public-Comment-Closes-on-DRBC-Fracking-Regulations"">first draft regulations</a> asking for them to be withdrawn because they were not protective of basin waters. The DRBC has until September 2021 to release new regulations on these matters.</p><p>PennFuture remains committed to protecting the Delaware River watershed from the harmful impacts of fracking and we will continue to engage on these matters. Please <a href=""/donate"">become a member today</a> to support our efforts!</p>",Climate; Community; Energy; Environment,"Abigail M. Jones, Vice President of Legal and Policy"
Introduction: An Intersectional Approach to Fighting the Petrochemical Buildout in Pennsylvania,6/23/2021,"<p>Modern-day Pennsylvania was molded by the rapid technological advancements of the Industrial Revolution. The result of such advancements on human health, however, was devastating: these facilities required fossil fuels (whichinvolvean environmentally destructive process to extract in the first place) which directly led to poor air quality, poisoned water, and destroyed soil in the decades to follow. Pennsylvaniasresidents are still feeling the effects of this today.</p><p>Science and technology have long been on a path of creating better machines which are much more environmentally friendly. However, especially in western Pennsylvania where I am now based, petrochemical companies are stubbornly refusing to acknowledge the world changing around them. Petrochemical companies hold over the heads of their workers the threat of losing their livelihood if the companies are further pushed by ""environmentalists.""</p><p>This is why I joined the fight. I believe in the dignity of the human being, and thus, the dignity of the worker. Every citizen deserves not only a job, but a job that respects the air they breathe, water they drink, and land they live on. I aim to look at our work through this intersectional lens, as environmental issues (specifically the petrochemical and plastics issues) are directly correlated with every person's socioeconomic status, general health and wellbeing, and race, just to name a few.</p><p>My name is John Ukenye, and I am originally from South Florida, but am now based in Pittsburgh. Both sides of my family's story are immigrant ones, with my father's story in the United States beginning in Pittsburgh itself. After relocating to South Florida to continue his collegiate studies, hebrought me to western Pennsylvania throughout my childhood and I fell in love with its natural beauty and the friendly people that live here. I knew early in my life that I was called to this state and to lend whatever talents I cultivated to help. The environmental realm is one that reaches all Pennsylvanians, and sits at the center of all other issues every person in the state faces.</p><p>My first direct experience in the environmental space was during my time as a law clerk with the U.S. House of RepresentativesCommittee on Oversight and Reform, Subcommittee on Environment in Spring 2020, right beforeCOVID-19reached ""pandemic"" designation. One of the last issues I was working on was preparing for a series of hearings on plastic pollution and the over-extraction of water from regional aquifers. I did research on how plastic water bottle manufacturers capitalized on the corroded lead pipe situation in Flint, Michigan by selling and donating what was essentially their own local tap water back to the affected people in the region, now additionally wrapped in toxic plastic single-use packaging. This situation perfectly highlighted the intersection between the environment, the plastics industry, race, and class.</p><p>My goal, from the moment I knew I wanted to go to law school, was to promote equity and justice no matter where I ended up. I fought my way through my undergraduate education, finished in three years with two degrees, honors, and Phi Beta Kappa and was admitted to Washington University School of Law where I graduated roughly a year ago. I graduated into a world that was facing a pandemic and a civil rights and social justice reckoning simultaneously, where race and class issues became dinner table conversations across the country and the globe. Average, everyday people<a href=""https://www.merriam-webster.com/dictionary/intersectionality"">began to see the intersectionality</a> among EVERY issue, and these discussions continue on to this day. This is a perfect time as ever to view our work from a similar equity, justice, and intersectional perspective.</p><p>Our membership is no doubt plugged in to the environmental issues plaguing our world, country, state, and Appalachian region. While important to keep our supporters engaged, we must continue to actively reach out to those less informed about our area of work. It is those individuals who stand to be harmed the most by continued inaction on the environmental front.</p><p>These individuals include both rural western Pennsylvanians (as well as the rest of Appalachia), especially those who work in the dying fracked gas industry, and Black and brown families that live near petrochemical plants due to historic redlining and environmental racism. Both groups stand to gain from uniting against the fracked gas, petrochemical, and plastics industries. Both groups are in generally in the same socioeconomic class, and both generally face the same issues of dirty air, water, and land caused by the petrochemical industry and plastic pollution. It is this disproportionate burden of <a href=""https://www.dep.pa.gov/PublicParticipation/OfficeofEnvironmentalJustice/pages/default.aspx"">harmful environmental and human health impacts</a> that environmental justice seeks to overcome.</p><p>Both groups include hardworking people trying to feed their families, and do not deserve to have their ability to provide for their families threatened by petrochemical companies that are simultaneously destroying their land, water, and air.</p><p>We must explicitly recognize this intersectionality in the work we do, highlight both their struggles and triumphs from local leaders in the environmental space, and work to do our part to encourage the creation of better-paying green jobs that respect workers rightsto breath, drink, and live freely.</p>",Climate; Community; Energy; Environment,"John Ukenye, Policy Analyst"
Biden Administration Working to Repeal Trump's 'Dirty Water Rule',6/17/2021,"<p>We bring to you another update in the decades-long saga of protecting ""waters of the United States"" (WOTUS) under the federal Clean Water Act, but this time it is a positive step toward renewing federal jurisdiction over some of our most critical streams and wetlands that were stripped of protection by the Trump Administration in 2020.</p><p>Since the United States Supreme Court's 2006 split decision in Rapanos v. United States, there has been uncertainty and litigation over what waterbodies classify as WOTUS and therefore will fall within the Clean Water Act's protections. PennFuture joined <a href=""/Blog-Item-PennFuture-Opposes-Any-Repeal-of-the-Clean-Water-Rule"">over 50,000 Pennsylvanians in supporting the 2015 Clean Water Rule</a> that attempted to bring clarity to the definition of WOTUS. And we vigorously opposed <a href=""/Blog-Item-PennFuture-Opposes-Any-Repeal-of-the-Clean-Water-Rule"">the Trump Administration's repeal</a> and <a href=""/Blog-Item-PennFuture-Submits-Comments-Opposing-the-Dirty-Water-Rule-Engages-More-Than-1400-Citizens-to-Do-the-Same"">replacement of the Clean Water Rule</a> with the 2020 Navigable Waters Protection Rule, more correctly known as the ""Dirty Water Rule."" Despite numerous legal challenges across the nation which lead to a patchwork of rules, as of March 2021, the Dirty Water Rule is in effect in all 50 states.</p><p>On June 9, 2021, however, the Biden administration <a href=""https://www.epa.gov/wotus/intention-revise-definition-waters-united-states"">formally began the process to repeal and replace</a> the Dirty Water Rule, which reduced the number of water bodies that would be protected by the Clean Water Act <a href=""https://www.msn.com/en-us/news/politics/biden-moves-to-restore-clean-water-safeguards-ended-by-trump/ar-AAKSsNZ?ocid=BingNewsSearch"">by twenty-five percent</a> and was determined to have led to significant environmental degradation, with thousands of streams and hundreds of permits at jeopardy. Across the country, thousands of wetlands and waterways that maintain water quality and drinking water sources and protect nearby communities from flooding <a href=""https://www.southernenvironment.org/news-and-press/news-feed/biden-administration-announcement-leaves-crucial-waters-in-jeopardy"">have already been destroyed</a> as a result of the Dirty Water Rule.</p><p>The Dirty Water Rule excludes ephemeral waters (temporary water bodies that only occur after precipitation) and wetlands that are not physically connected to a navigable water body by a visible surface connection. The rule is not based on science and greatly benefited the oil and gas industry and developers by allowing them to fill in wetlands and streams without a permit. The reality is that wetlands are extremely important natural filters that protect waterbodies, whether they are visibly connected by a continuous surface connection or not. Ephemeral waters <a href=""https://www.epa.gov/sites/production/files/2015-03/documents/ephemeral_streams_report_final_508-kepner.pdf"">play crucial ecological and hydrological roles</a> in maintaining water quality and watershed function and health, and are particularly important in the southwestern states. The EPA's own data shows that ephemeral waters provide drinking water to 117 million Americans.</p><p>The new rule will aim to restore protections and establish a durable definition of protected waters. EPA's <a href=""https://www.epa.gov/newsreleases/epa-army-announce-intent-revise-definition-wotus"">news release explained</a> that the new rule will be informed by Supreme Court precedent, lessons learned from current and previous regulations, and stakeholder engagement. Additionally, it will be guided by considerations to protect water resources and communities, science and the effects of climate change to national waters, and efforts for practical implementation in states and Tribal communities. The Dirty Water Rule, by contrast, <a href=""https://yosemite.epa.gov/sab/sabproduct.nsf/ea5d9a9b55cc319285256cbd005a472e/5939af1252ddadfb852584e10053d472/$FILE/WOTUS SAB Draft Commentary_10_16_19_.pdf"">was admonished by EPA's own science advisors</a> as being in conflict with established science and the objectives of the Clean Water Act.</p><p>And some of the impacts from the Dirty Water Rule are already being felt locally by threatening restoration efforts of the Chesapeake Bay Watershed because excluded waters feed into the Chesapeake Bay. The Choose Clean Water Coalition, a coalition of organizations that advocate for clean rivers and streams in the Chesapeake Bay region of which PennFuture is the PA State Lead, <a href=""https://www.choosecleanwater.org/news/2021/6/10/plans-to-repeal-dirty-water-rule-a-big-win-for-chesapeake-bay"">released a statement supporting the EPA's decision</a> to revise the current rule and also urge them to replace it with one that restores protections to waterways and wetlands.</p><p>Stakeholders are encouraged to share their input during the rulemaking process. <a href=""https://www.epa.gov/wotus/public-outreach-and-stakeholder-engagement-activities-forthcoming"">Information on opportunities for public engagement</a> are forthcoming and PennFuture intends to engage in this process to ensure full protections of our critical headwaters and wetlands. <a href=""/donate"">Become a PennFuture member today</a> to stay informed and get engaged!</p><p>More information on the Dirty Water Rule:</p><ul><li><a href=""/Blog-Item-New-Definition-of-Waters-of-the-United-States-Threatens-Clean-Water-Act-Protections"">PennFuture's blog post on the Dirty Water Rule</a></li><li><a href=""https://www.facebook.com/watch/live/?v=356380261631140&ref=watch_permalink"">Video presentation on the Dirty Water Rule</a></li></ul>",Climate; Community; Environment,"Emily Rollins, Legal Intern"
The Plastics Problem: More False Strategies: Statewide Preemption,6/15/2021,"<p>Regular readers of this blog will be familiar with the Pennsylvania Legislature's attempts to <a href=""/Blog-Item-Regulatory-Reforms-Would-Roll-Back-Environmental-and-Health-Protections"">stymie advances in environmental protection</a> and <a href=""/Blog-Item-Legislators-Continue-to-Stand-in-the-Way-of-Climate-Action"">efforts to deny the realities of climate change.</a></p><p>Our Legislature has been employing a new strategy when it comes to promoting plastics and petrochemicals, and it is just as problematic. That problematic strategy is known as ""preemption.""</p><p>Preemption is the legal concept that a higher-level governmental body can prevent or overrule the actions of lower-level governmental bodies. For example, the federal government can pass laws or regulations that stop a state from passing different laws on a specific issue , or that override laws previously passed by a state on an issue. Similarly, a state legislature can pass laws that stop or override municipalities in that state from enacting laws or override laws that the municipality has previously passed.</p><p>Preemption is not, in the abstract, necessarily a bad thing. There are reasons why a state might want to have a whole-of-state approach to a certain issue, rather than having piecemeal regulation by different municipalities across the state.</p><p>For example, the state may want to have - and indeed does have! - uniform rules on how drivers' licenses are issued because there is a reasonable interest in having statewide uniformity in requirements for testing and licensing procedures, rather than having each town or city design its own rules for allowing drivers on the roads.</p><p>Here, however, the Legislature is not trying to make uniform rules across the Commonwealth for safety reasons, or to lessen the burden on municipalities, or to benefit a statewide goal. Here, the legislature is trying to stop municipalities from taking environmentally-beneficial actions in order to protect the fossil fuel and petrochemical industries.</p><p>The first example is the Legislature's action to prevent municipalities from banning single-use plastic bags.</p><p>In June of 2019, the Pennsylvania Legislature passed a fiscal code amendment (SB712) that included, as an add-on provision unconnected to the rest of the fiscal code, a prohibition which states: the ""General Assembly or a local governmental body or agency may not enact a law, rule, regulation or ordinance imposing a tax on or relating to the use, disposition, sale, prohibition or restriction of single-use plastics, reusable plastics, auxiliary containers, wrappings, or polystyrene containers"" until a report on the economic and environmental impact of plastics on the Commonwealth was submitted.</p><p>This report was submitted in June 2020. Around that same time, in the middle of the Covid-19 pandemic, the Legislature again used the fiscal code to effectively delay implementation of any current plastic bag bans at least until July 1, 2021, or six months after the COVID-19 state of emergency is lifted.</p><p>Why would the Legislature do this?In order to promote uniform plastics laws across the Commonwealth?This cannot be the case, because there are no other statewide plastics laws in Pennsylvania.In fact, the Legislature here is not acting to promote positive statewide regulation at all, but instead to promote the petrochemical industry.</p><p>The state's own report on ""The Economic Impacts of Regulation of Single Use Plastics"" is very clear: ""The regulation of single-use plastics could also have indirect implications for the prospective clustering of petrochemical manufacturing facilities in the state. Pennsylvania is the second-largest producer of natural gas in the U.S. and the state's capacity for natural gas production and proximity to major markets make it an attractive location for new petrochemical facilities...Industry representatives noted that single-use plastics regulation could make the state a less viable option for prospective petrochemical and plastics manufacturers:""<a href=""http://www.ifo.state.pa.us/download.cfm?file=Resources/Documents/Single-Use%20Plastics%20Report-2020_06.pdf"">Economic Impact Report at page 33, 35.</a></p><p>Municipalities, of course, <a href=""https://www.penncapital-star.com/energy-environment/plastic-bag-preemption-suit-takes-aim-at-long-time-harrisburg-dealmaking-mechanism/"">have taken a different view.</a>Municipalities across the state have considered banning or otherwise regulating single-use plastics.The City of Philadelphia, Narbeth, and West Chester have passed ordinances doing so. Other municipalities, such as Ferguson Township in Centre County, the City of Bethlehem, and the City of Pittsburgh have actively considered doing so. These local government entities have pointed to <a href=""https://www.inquirer.com/science/climate/philadelphia-single-use-plastic-bag-ban-mark-squilla-20190620.html"">plastic bag litter in their borders and clogging their waterways</a> as reasons to pass these ordinances.</p><p>The second example is the Legislature's ongoing attempt to prevent municipalities from restricting the types of energy used in buildings.Again, why would the legislature do this?To promote a uniform energy policy across the state?No, it is clear that the Legislature wants to promote the use of fracked gas.</p><p>The legislature previously tried, through Act 13 in 2013, to specifically eliminate the ability of municipalities to regulate the development of oil and gas resources. The PA State Supreme Court <a href=""http://www.pacourts.us/assets/opinions/Supreme/out/J-127A-D-2012oajc.pdf"">struck down this provision</a> as a violation of the Environmental Rights Amendment of the Pennsylvania Constitution.</p><p>The Legislature <a href=""https://www.penncapital-star.com/government-politics/an-energy-choice-bill-has-some-lawmakers-worried-local-government-could-lose-power/"">is currently trying to enact very similar legislation</a> targeted at utility services rather than gas development companies, but the effect would be the same, and by focusing only on utility services the proposed legislation <a href=""https://local-government.pasenategop.com/wp-content/uploads/sites/62/2021/05/Additional-Testimony-PENNFUTURE-Letter-to-PA-Senate-on-SB-275-May-7-2021.pdf"">would give preferential treatment</a> to the polluting gas industry.</p><p>In the City of Philadelphia, the Office of Sustainability <a href=""https://www.inquirer.com/opinion/editorials/philadelphia-gas-works-pgw-public-utility-climate-change-lng-20210607.html"">is conducting a study</a> about how the gas utility, Philadelphia Gas Works, can transition away from being an entirely gas-driven utility, in line with Mayor Jim Kenneys commitment that Philadelphia will achieve carbon neutrality by 2050 in alignment with the Paris Agreement.The Legislature's preemption attempt here would stop this work in Philadelphia in its tracks.</p><p>To be fair, the Pennsylvania Legislature is not alone in attempting to stop the municipalities in its state from making positive environmental changes. This is a strategy that national anti-regulatory groups are pushing to state legislatures nationwide to prevent local governments from taking the initiative to solve their own problems.</p><p>The real problem with this sort of preemption is that it doesn't solve any problems - it just puts up roadblocks to creating meaningful policy change.</p><p>The Legislature is not pushing solutions or enacting statewide policies; instead, it is just telling municipalities that they are prevented from the sort of creative problem solving that the American system of federalism is supposed to promote. When it comes to the problem of plastics, we need real solutions, not roadblocks.</p>",Climate; Community; Energy; Environment,"Jessica O'Neill, Senior Attorney"
