Blog Item Title,Schedule post date,Blog Full Text,Blog Category,Blog Authors,,
Empowering Voices: The Vital Role of Civic Engagement in Protecting Our Environment,10/29/2024,"<p>Democracy is the cornerstone of our country and the basis of how decisions are made, including those that directly affect our environment. Our own state constitution defines our right to things like clean air, pure water, and preserved natural places.</p><p>At PennFuture, our mission is focused on ensuring we have the legislation and regulations in place to protect the place we call home - all through legal advocacy, policy expertise, and civic engagement.</p><p>All of what we do functions within our system of democracy which we as voters have a say in! The people we vote for are the people who vow to uphold that constitutional right of ours.</p><p>That's why a civically engaged population is critical to our mission. Our vote is our power, and our Civic Engagement team works every year <a href=""https://secure.everyaction.com/awns8aE-WEmcsPQkttDljw2"">to ensure that everyone is ready to cast their ballot</a>. A functioning, strong democracy and a representative government will lead to stronger, safer environmental protections for us all. But that starts with all of us voting. After so many fought for our right to vote and make our voices heard - it is important that we exercise and protect that right.</p><p>With Election Day coming up on <strong>Tuesday, November 5</strong>, the importance of engaging with our democracy is top of our minds now more than ever. Our Civic Engagement team is ready to help our advocates, members, and subscribers get prepared for this election - we want to make sure you are all set and ready to vote!</p><p>In just a few simple steps, you can make sure you are ready to cast your ballot and make your voice heard:</p><ul><li>Make a plan! <ul><li>Heading to the polls on Election Day between 7am and 8pm? Check your polling place <a href=""https://www.pa.gov/en/services/vote/find-your-local-polling-place.html"">here</a>.</li><li>Already requested a mail-in ballot? Drop it in the mail ASAP or drop it off at a local dropbox or your County's Board of Elections office.</li></ul></li></ul><ul><li>Find out who is on your ballot: <ul><li>Your vote is your choice. Every seat on your ballot matters. Check out who's on your ballot and their positions by heading to<a href=""http://www.vote411.org/ballot""> www.vote411.org/ballot</a>.</li></ul></li></ul><ul><li>Having an issue or need assistance casting your ballot? <ul><li>Head to <a href=""http://vote.pa/help"">vote.pa/help</a> to call the Voter Protection Hotline or get personalized assistance from a member of the Vote Navigator team.</li></ul></li></ul><ul><li>Last but not least: if you have the time - help our Civic Engagement team work on empowering voters across Pennsylvania this fall to cast their ballot. <ul><li><a href=""https://secure.everyaction.com/awns8aE-WEmcsPQkttDljw2"">Sign up here</a> if you're interested, and a member of our team will be in touch with you shortly with the opportunities available.</li></ul></li></ul><p>Thanks for casting your ballot, making your voice heard, and exercising your right to vote!</p>",Environment,"Jess Cadorette, Director of Civic Engagement",,
Introducing PennFuture's New Fall Term Legal Interns!,10/4/2024,"<p>Since its inception in 1998, PennFuture has emphasized the importance of using the law to protect Pennsylvania's environment and ""create a just future where nature, communities, and the economy thrive.""</p><p>Over the past two decades, we have achieved significant legal and policy victories that reduce pollution and protect the environment and our communities. We have provided millions of dollars in pro bono legal services while setting critical precedents and enforcing environmental laws across the Commonwealth.</p><p>But as PennFuture looks forward to the next 20 years, we recognize that we need to be more involved with cultivating the people that will continue to support our mission. Our staff have a long history of mentoring interns, externs, and fellows, and we wanted to create a more formal program to inspire the next generation.<br /> With the generous support of the George and Miriam Martin Foundation and the Otto Haas Charitable Trust, PennFuture created a paid legal internship program to inspire and mentor students interested in making a difference for our environment.</p><p>Ultimately, the goal of this program is to provide the organization a cadre of young legal and policy minds interested in taking on the myriad challenges impacting Pennsylvania as well as to further their potential environmental careers. We've seen success on this front as many of our legal interns have found work in the Pennsylvania environmental legal space. We also hope that providing for a funded internship will help to bring more diversity and inclusivity into the non-profit environmental advocacy sphere.</p><p>Over the past four years, our interns have made it possible for PennFuture's legal team to do more, faster, and better! They have supported our litigation efforts against water polluters and fracked-gas facilities, they have drafted comments in support of stronger regulatory protections across the Commonwealth, and they have helped our attorneys strategize and execute impactful legal actions. We are grateful for all of the hard work, passion, and dedication of our legal interns.<br /> This summer, we have three fantastic students for our internship, representing a range of backgrounds and experiences. We've asked our new interns to explain, in their own words, what environmental law and PennFuture's mission means to them:</p><h3><img class=""align-left"" src=""/Files/Admin/VeronicPorter.jpg"" /><strong>Veronic Porter, Third Year student at Widener University Commonwealth Law</strong></h3><p>When I was a child I loved to be outdoors and loved helping any animal I came across. It was for this love for the environment and wildlife that I knew from a young age that I wanted to do my part in helping to protect and conserve the environment.</p><p>It was this passion that drove me to obtain my undergraduate major in Environmental Science and Policy from the University of South Florida. From courses taken in my undergraduate education and from my strong passion to protect the environment, I was motivated to attend Widener University Commonwealth Law School with the hopes to pursue a career in Environmental Law after graduation. At Widener University Commonwealth Law School, I am a member of the Animal Legal Defense Fund and I am pursuing a Certificate in Environmental Law.</p><p>I was drawn to apply as an Intern with PennFuture because I related to PennFutures' dedication to protecting the environment and fighting for sustainable communities for generations to come. I also really admired PennFutures' efforts to educate and outreach to citizens in Pennsylvania to help empower them to fight for change in our communities.</p><p>Interning with PennFuture has given me the ability to expand my knowledge in Environmental Law by sharpening my research and writing skills as well as providing me with opportunities to learn first-hand about the litigation process surrounding current Environmental issues affecting Pennsylvania residents. PennFuture has solidified that Environmental Law is the field of law that I want to go into and has given me the opportunity to work with an organization that prioritizes advancing an environmentally friendly and sustainable community.</p><h3><strong><img class=""align-left"" src=""/Files/Admin/Jeremy%2DZimmerman%5F05%5F4x6.jpg"" />Jeremy Zimmerman, Second Year student at Penn State Dickinson Law</strong></h3><p>Growing up in Lancaster County, I have seen drastic changes in our local environment as forests and farms have been turned into parking lots and strip malls time and time again. Growing up in such a dynamic environment piqued my interest at a young age into environmental issues and political issues in my local community.</p><p>These two passions guided my educational journey, enrolling in a dual degree program which coalesced my interests. I received a Bachelor of Arts from the Paris Institute of Political Science and a second bachelors degree from Columbia University in Sustainable Development. I never lost sight of home though, for my senior honors thesis I examined the socio-economic impacts of hydraulic fracturing on Pennsylvanias Northern Tier and continued to be involved with local issues.</p><p>After undergrad I joined my municipalitys Sustainable Advisory Committee and became a technical consultant for the private sector helping businesses to achieve and keep compliance with environmental regulations. For two and a half years I inspected factories, collected field samples, wrote reports, and gave staff trainings to help ensure businesses were keeping our environment clean.</p><p>It was ultimately this exposure to environmental regulations that sparked my interest in the law and led me to attend Penn State Dickinson Law where I am currently in my second year. I am tremendously excited to be at PennFuture where all of my passions in life- the environment, Pennsylvania, and the law come together!</p>",Environment,"Abigail M. Jones, Vice President of Legal and Policy",,
What You Need to Know About Being a Poll Worker,9/24/2024,"<p>Your community needs you! By serving as a poll worker, you will ensure that the voting process runs smoothly on Election Day. Its an excellent opportunity to connect with your neighbors and play a vital role in the democratic process. Regular citizens who volunteer as poll workers are passionate about civic engagement and get firsthand participation in the inner workings of our electoral system.</p><p><strong>PennFuture's Managing Attorney for Litigation Jessica O'Neill</strong> shares her experience as an election worker for the past 8 years and <strong>PennFuture's Advocacy Manager Michael Mehrazar</strong> shares his background as a poll worker trainer below.</p><p>But first, please review the Pennsylvania poll worker criteria:</p><p><br /><strong>Q. Who can be a poll worker?</strong><br /> There are a few requirements to becoming a poll worker in PA.</p><ul><li>Generally, poll workers must be registered voters in their county.</li><li>Must not hold any public office, appointment or employment in the government.</li><li>Must not be a candidate running for public office on the ballot in precinct (exceptions for Judge and Inspector of elections).</li><li>Must be completely non-partisan while serving in the precinct (not campaigning, handing out literature or wearing political items), and must work to keep the rest of the room where voting occurs a ""campaign free zone."" The ""campaign free zone"" in the polling place is to ensure that voters are free to cast ballots without influence or intimidation.</li><li>You must be patient and a good listener for those showing up to cast a ballot.</li></ul><p>*Special skills like language interpretation or ASL fluency are critical to making the polls and voting as accessible as possible for all.</p><p><strong>Q. I am under 18 years old. Can I be a poll worker?</strong><br /> It varies by location. To check to see if your location accepts student poll workers, please enter your zip code here: <a href=""https://powerthepolls.com/search"">https://powerthepolls.com/search</a></p><p><strong>Q. How do I apply to be a poll worker?</strong><br /> You can submit your interest at this link: <a href=""https://powerthepolls.com/cvpa&pf"">https://powerthepolls.com/cvpa&pf</a></p><p><strong>Q. When is the deadline to apply to be a poll worker?</strong><br /> Most election administrators accept applications on a rolling basis. Once you submit your interest, your county or jurisdiction will reach out to you on dates for training.</p><p><strong>Q. Do I need to go through specific poll worker training?</strong><br /> Yes. Local jurisdictions can host both in-person and online training events ahead of Election Day and will fully prepare you for your shift. For example, in Pittsburgh, training typically lasts up to 2 hours for new poll workers.</p><p><strong>Q. What specific dutiesare available to poll workers?</strong></p><p>The jobs will depend on the county. For example, in <a href=""https://www.alleghenycounty.us/Government/Elections/Poll-Workers"">Allegheny County</a>, you can be assigned as Judge of Election, Inspector, or Clerk of Election depending on your skill set.</p><p><strong>Q. Will I get paid to be a poll worker?</strong><br /> Many jurisdictions in PA provide compensation for poll workers on election day and for training. Compensation varies by jurisdiction and you can review by submitting your zip code here https://www.powerthepolls.org/search<br /> For example, in Philadelphia, a poll worker who works the full day can receive $200 to $205 for Election Day, and $30 to $50 for training.</p><p><strong>Q. When do polls open and close?</strong><br /> In Pennsylvania, the polls open at 7:00 am and close at 8:00 pm.</p><hr /><h2><strong>I'M A POLL WORKER</strong></h2><p><strong><img class=""align-left"" src=""/Files/Admin/Jessica.jpg"" /></strong></p><p><strong>Q. Why did you want to be a poll worker?</strong></p><p>In the 2016 general election, my polling place was overwhelmed with 3+ hour-long lines to vote. The neighborhoods population had changed, and many more voters would vote that year using antiquated voting machines and procedures. The few poll workers just couldnt keep up. They were doing their best, but it was just too much.</p><p>I watched potential voters leave the lines because they were so long. I vowed to get involved to make sure that even if I couldnt fix the infrastructure problems, I could help use my skills to make things more efficient and secure and ensure no one would ever walk out of a polling line again.</p><p><strong>Q. What was your poll worker training like? How long was your training?</strong></p><p>In Philadelphia County, there is in-person and online training. I recommend doing both if you can (both are about a half hour long). Many of the other poll workers will have a lot of experience - talk to them to learn how everything works! Make sure that you show up an hour before voting begins so you can have time to get the polling place set up and get ready.</p><p><strong>Q. On election day, when did you show up to your shift and how long did you work?</strong></p><p>There are no shifts - get ready for a long day! I show up an hour before polls open, which is usually at 5:45 am. As the judge of elections, I am bringing some of the election materials from the county with me, and I want to be there first to be ready to greet my workers.</p><p>There is a lot to do to set up the polling place, so we launch right into it. I appreciate having poll workers who are willing to just get straight to work even if they have never worked an election before. There are many set up tasks that anyone can do with a little direction!</p><p>Polls open in Pennsylvania from 7 am to 8 pm. Anyone who is still in line at 8 pm can vote, and we do not start closing the polls until after 8 pm even if there is no one in line. I usually can excuse my poll workers by 9 pm, but if there is a line, then we are all there longer.</p><p>As the judge of elections, I am responsible for the election materials. A police officer comes and picks up the ballots sometime after 8 pm, and I am responsible for bringing other election materials back to the board of elections after we are all closed up.</p><p><strong>Q. What did you wear?</strong></p><p>Comfortable clothing is a must! Supportive footwear and layers, as the temperature will change a lot through the day depending on how many people are in line in the room! No shirts or other attire supporting a candidate is allowed. I always wear a pin that says ""Vote!"" and I have another poll worker with amazing ""go vote!"" socks.</p><p><strong>Q. Are you allowed to bring anything with you / should you bring something with you (ie. lunch, a book)?</strong></p><p>You may get a break so it's a good idea to bring a book or magazine. In Philadelphia, there are various organizations that try to make sure that meals are provided to poll workers throughout the day. It often ends up being a bunch of donuts in the morning and a pizza at dinner. Different counties might have different procedures on meals.</p><p><strong>Q. How would you describe your poll worker job on election day? What were your specific tasks?</strong></p><p>As the judge of elections, I manage the entire polling place. I ensure that the poll books are correct, that the machines are working, and that my poll workers understand and can do their jobs.</p><p>I also make sure that election laws are followed - that folks distributing campaign literature stay the appropriate number of feet outside the polling place, that no voter is being harassed or intimidated, and that election watchers are permitted as provided by law and are following the rules.</p><p>Most importantly, though, my job is ensuring registered voters can cast their ballots! If they need to show ID, I make sure they understand why and help them meet the requirements under the law. If they are at the wrong polling place, I help them figure out what polling place they are supposed to be at and make sure they know where to find it. Suppose they aren't permitted to vote on the voting machines (for example, they were issued a mail-in ballot or their name isn't in the poll book). In that case, I make sure they understand why, give them the provisional ballot and the receipt, and follow the appropriate steps to get that provisional ballot in.</p><p>My goal is for a registered, eligible voter coming into the polling place can walk out trusting the electoral system and be confident that their vote will be counted.</p><p><strong>Q. Did any problems occur that you helped to solve?</strong></p><p>Countless! It's what I do all day long.</p><p><strong>Q. What did you like about your job as a poll worker?</strong></p><p>I like knowing my neighbors and knowing that they know me as a trustworthy person who helps them vote. My favorite moments throughout the day are when someone brings in their 18-year-old kid to vote for the first time: someone yells out, ""First-time voter!"" and all the poll workers cheer and applaud.</p><p>I also have a voter in his 90s who never misses an election, and I get such a kick out of seeing him come in and cast his ballot. My work is a bright spot that makes me feel good about our democracy.</p><hr /><h2><strong>I WAS A POLL WORKER TRAINER</strong></h2><p><strong><img class=""align-left"" src=""/Files/Admin/Michael.jpg"" />Q. Why did you want to be a poll worker?</strong></p><p>Ever since childhood, I have been fascinated by the electoral process. I vividly remember my dad taking me into the polling booth when I was eight. This early experience sparked my interest, and it should be no surprise that I went on to study political science in college.</p><p>Soon after graduating, I applied for and was fortunate to receive a job at the Anne Arundel County Board of Elections in Maryland. I was honored to secure a position so closely involved with the administration of our electoral system just after completing my studies. This experience helped me lead the way to future electoral and government work, including my role as Advocacy Manager at PennFuture today.</p><p><strong>Q. What was your poll worker training like? How long was your training?</strong></p><p>I was hired as a trainer to help train citizens interested in becoming Election Judges. Our training program consisted of an intensive two-week overview of all aspects of electoral laws and procedures in Maryland. This involved lectures, written components, and hands-on familiarity with the various election equipment.</p><p>After the initial training, we spent another two weeks manually reviewing the voting machines to catch any potential flaws or issues. (2014 was the last election in which Maryland used a touchscreen voting system rather than the more secure paper record voting system. <a href=""https://elections.maryland.gov/voting_system/learn_about_the_new_voting_system.html"">More information here</a>)<br /> We would then spend the remaining time leading up to the election training citizens to become certified election judges. Following the election, we spent several weeks completing the necessary post-election work, including ballot counting, post-operation review, and other administrative tasks.</p><p>The training sessions we ran typically lasted around 2 hours. During these sessions, we would review the election judge manual, review the various judge roles (check-in judge, voter judge, provisional judge, and chief judge), and cover the opening procedures, during-the-day procedures, and closing procedures. We would also incorporate role-playing exercises to help prepare the judges.</p><p>Overall, I believe our judges were well-trained and equipped to handle their responsibilities on election day.</p><p><strong>Q. Any question that you recommend new poll workers ask during training?</strong></p><p>I suggest reading ahead of time to ensure you have a sense of the basic procedure during the training. Try to inquire about any potential edge cases or nuances that may arise on Election Day. Id also recommend asking questions about the measures in place to secure the voting process, as many unfounded concerns are circulating about election integrity, and it would be great to know the accurate information to help mitigate those fears.</p><p><strong>Q. On election day, when did you show up to your shift and how long did you work?</strong></p><p>As a trainer, my role on election day was to observe multiple polling places and ensure proper procedures were followed. I was also on call in case any serious issues arose. My day began at 6:00 am and did not end until close to midnight, as I was responsible for processing all the materials, including the computer cards that held the votes.</p><p>For most polling workers, however, the day typically started about half an hour before the polls opened and ended about half an hour after the polls closed (roughly 6:30 am to 8:30 pm).</p><p><strong>Q. What did you wear?</strong></p><p>We had a uniform, which included a black polo and khakis. I don't think most places have a specific dress code for election judges, but I'm not sure. Whatever you wear, make sure it's comfortable - it's a long day!</p><p><strong>Q. Are you allowed to bring anything with you / should you bring something with you (ie. lunch, a book)?</strong></p><p>I believe you're allowed to bring food. Books would be fine too, as long as they weren't political in nature or in favor of any of the candidates. I would certainly ask your trainers.</p><p><strong>Q. How would you describe your poll worker job on election day? What were your specific tasks?</strong></p><p>Back in 2014 in Maryland, there were four different poll worker roles:</p><ul><li>Check-in Judges: These judges check voters names against the registration list to verify they were at the correct polling location. They would also help direct voters to the appropriate polling place or inform them if they needed to cast a provisional ballot.</li><li>Voting Judges: These judges would guide voters to the voting machines and assist them with any questions or issues they encounter during the voting process.</li><li>Provisional Judges: These judges would staff the provisional ballot station, handling ballots for voters who faced eligibility issues that prevented them from casting a regular ballot. If the voters eligibility was later confirmed within the allotted time frame (typically 10 days), their provisional ballot would be counted.</li><li>Chief Judges: The chief judges were responsible for managing the overall operations of the polling place. Typically, they are election day veterans, having run many elections before. They are required to be bipartisan, with one Democrat and one Republican serving together. On election night, the chief judges would also be tasked with delivering the voting equipment to the Board of Elections.</li></ul><p><strong>Q. Did any problems occur that you helped to solve?</strong></p><p>Yes, there were various logistical issues, such as signs not being placed in the right locations, people campaigning too close to the polling places, and check-in computers needing to be fixed. No matter how much training is provided, things rarely go perfectly on election day.</p><p><strong>Q. What did you like about your job as a poll worker?</strong></p><p>Besides the camaraderie I had with my team, I found it fascinating to learn about the significant behind-the-scenes efforts that go into securing our elections. These efforts, often unnoticed by the general public, involve numerous security measures such as tamper-evident seals, serial number matching, locked bags, and the presence of bipartisan poll watchers. This learning experience has deepened my understanding of the integrity and fairness of our elections.</p><hr /><p>Still interested in becoming a poll worker? Pleasesubmit your interest at this link:<a href=""https://powerthepolls.com/cvpa&pf"">https://powerthepolls.com/cvpa&pf</a></p>",Community,"Leigh Martinez, Communications Director",,
