Blog Item Title,Schedule post date,Blog Full Text,Blog Category,Blog Authors,,
Pennsylvania needs PRESS now more than ever,7/3/2024,"<p>The fracked gas industry should be worried. Lawmakers are considering a bill to increase Pennsylvania's usage of clean energy sources. On June 24, 2024, the PA House Environmental Resources and Energy Committee held a hearing on HB 2277 (Otten) to consider the Pennsylvania Reliable Energy Sustainability Standard, better known as ""PRESS""-an overhaul of the Alternative Energy Portfolio Standard (AEPS) Act. PRESS envisions a future where 35% of our energy is derived from Tier I sources by 2035. This ambitious goal necessitates a significant expansion of our solar generation, a vision we glimpsed in the <a href=""https://www.dep.pa.gov/Business/Energy/OfficeofPollutionPrevention/SolarFuture/Pages/Finding-Pennsylvania%E2%80%99s-Solar-Future.aspx"">""Finding Pennsylvania's Solar Future""</a> project in 2018, along with parallel growth in wind and other clean sources.</p><h3><img class=""align-left"" src=""/Files/Admin/download.jpg"" /><strong>How did we get here?</strong></h3><p>In 2004, Pennsylvania passed the Alternative Energy Portfolio Standard (AEPS) Act to diversify its energy sources. The goal was to promote a cleaner environment and protect PA households from increasing energy costs. It accomplished this by establishing what is known as ""portfolio standards"" or targets, requiring energy companies to ensure that a certain percentage of the energy they sell in Pennsylvania comes from clean sources such as solar and wind, among others. Pennsylvania was among the first states to adopt a portfolio standard. Still, the goals set for clean energy turned out to be too modest-clean ""Tier I"" energy sources were to provide a mere 8% of our energy needs.</p><p>Consequently, other states surpassed us in attracting new clean energy development and the associated job opportunities.</p><h3><strong>Expanding solar generation is the right move for Pennsylvania.</strong></h3><p>If we hope to avoid the worst impacts of the growing climate crisis, we need to maximize our clean, renewable generation as quickly as possible. Cutting carbon pollution is vital, but more clean energy means fewer toxic air pollutants, heavy metals, harmful particulates, and smog-producing chemicals will be dumped in our atmosphere.</p><ul><li>Can I live near a solar farm and not develop asthma? <strong>Yes</strong>, there is no scientific evidence that living near a solar farm poses any health risks.</li><li>Can I raise children near a solar farm without them developing cancer? <strong>Yes</strong>, there is no scientific evidence that living near a solar farm poses any health risks.</li></ul><p><strong>The same cannot be said for living next to a fracking pad.</strong></p><p>Solar energy also makes economic sense. Sharon Pillar, Executive Director of the PA Solar Center, testified about recent modeling showing a bill like this bringing over $13 billion in new investment over the next few years and creating over 100,000 jobs. Robert Routh, attorney and Policy Director for the Natural Resources Defense Council, spoke about the Council's analysis, showing PRESS could create over 15,000 new jobs each year from 2025 through 2040 while increasing the energy we export to other states.</p><h3><img class=""align-left"" src=""/Files/Admin/6206184246%5Fce3ec3d39e%5Fw.jpg"" /><strong>We need PRESS now more than ever.</strong></h3><p>When AEPS was first considered, coal generation was responsible for 57 percent of Pennsylvanias electricity, and methane gas (in the days before fracking) provided less than 1 percent. Today, fracked gas provides more than 58 percent of our electricity, and coal is at 6 percent and falling.</p><p>While the fracking industry is quick to point out that coal's failure to compete in the market with fracked gas resulted in lower emissions, they want us to ignore that the gas boom has left us in a dangerous and unsustainable situation.</p><p>After the pandemic in 2022, fracked gas set bad records for its price volatility. Worse yet, retail prices in the region were almost 50 percent higher than at the start of the fracking boom. Not surprisingly, consumers' electric prices also spiked with the increasing dependence on fracked gas for generation.</p><p>While boom-and-bust volatility is common in the fossil fuel industry, the poor gas reliability problem exacerbated the situation. During Winter Storm Elliot, which struck Pennsylvania over Christmas 2023, more than 70 percent of the unplanned outages on the PJM power grid were caused by gas plants being unable to run when needed. That drove wholesale electric prices in some places on our grid over $3,700 per megawatt hour, more than 200 times our typical wholesale prices.</p><p>It would be ridiculous to imagine a financial advisor who, upon finding their client had 58% of their life savings in a highly volatile and risky stock, would recommend that the best course of action would be to double down and put even more eggs in that basket.</p><p>If you want to mitigate volatility and risk, the obvious answer is to diversify your investments. If someone were to suggest otherwise, you might suspect they are putting their own interests ahead of yours and (rightly) take everything they say with a large grain of salt. Hearing the fracking industry say Pennsylvania needs more gas is a giant red flag and should raise those same concerns.</p><h3><strong>The fracking industry has reason to worry.</strong></h3><p>Having seen the coal industry go from dominating the energy generation sector to a footnote in just a few years, the fracking industry is rightly scared of the same happening to them. The writing may be on the wall already-clean, renewable generation is often less expensive and is getting cheaper. When we look at ""active"" projects in our power grid's interconnection process, Pennsylvania has over 9,400 megawatts of solar and only 35 megawatts of gas in the pipeline. As much as the industry wants to blame environmentalists and regulators for its woes, it seems to have increasing difficulty convincing Wall Street that it is a good bet.</p><p>If there was any doubt that the industry is worried, the performance of one of the pro-fracking speakers from the Pennsylvania Manufacturers Association (PMA) at the hearing was telling. I can't say he included every misleading half-truth, scare tactic, or borderline conspiracy theory that anyone ever applied to solar energy. Still, if he left any out, it wasn't for lack of trying.</p><p>The telling exchange, though, came after his talk.</p><p>Representative Otten, the prime sponsor of the PRESS bill, spoke up: ""I am always entertained by your hyperbole..."" (she began before noting the speaker was, ostensibly, at the hearing representing Pennsylvania's manufacturing interests). </p><p>Rep. Otten: ""So is that the position of the Pennsylvania Manufacturers Association that youre not interested in and taking advantage of the federal programs [Bipartisan Infrastructure Act and the Inflation Reduction Act] that are designed to grow the economy and bring jobs to Pennsylvania?""</p><p>Rather than answer ""no,"" the speaker took the opportunity to lecture the Representative on the virtues of private investment and expressed concern that competition in the market might cause the gas industry to ""lose organic economic growth.""</p><p>Rep. Causer added an accusation that investments such as these were a case of the government ""picking winners and losers."" </p><p>While the speaker from PMA referred to federal clean energy investments as ""market manipulations,"" neither he nor Rep. Causer mentioned how heavily subsidized the fossil fuel industry has been at the state and federal levels for decades. Also, when Rep. Armanini-who earlier criticized clean energy-complained that a company in his district didn't qualify for a particular government program, he didn't get the same lecture on the virtue of private investment; there was no suggestion that the program was a ""market manipulation;"" there was just a mournful look from the speaker who said, ""that is very sad.""</p><p>Its important to ask: Why is it that the polluting industry never seems to be held to the same standards as clean energy?</p><p><em>PennFuture is ramping up our efforts to connect economic development to environmental issues to promote a healthy economy, healthy communities, and a healthy environment. If you'd like to support our efforts on sustainable economic development in Pennsylvania, please consider <a href=""/donate"">becoming a member today</a>. Your support is what makes reports like this possible.</em></p>",Energy; Environment,"Rob Altenburg, Senior Director for Energy and Climate",,
The Unspoken Truth: Economic Policy is Environmental Policy,6/28/2024,"<p><span>(<strong>Title image:</strong> Shell Cracker Plant by Mark Dixon)</span></p><p>Economic development projects shape the landscape and impact everyday life by influencing air quality, traffic volume, stormwater flow, and local employment opportunities.</p><p>Economic development can bring massive benefits to our communities, but it also brings other consequences that must be considered. These social and environmental considerations are known as ""externalities."" The most common and visible examples in Pennsylvania include abandoned mine drainage leaching pollution into local waterways, job loss due to the closure of coal-fired power plants, and toxic emissions that degrade air quality and hasten climate change. These externalities often have a disproportionate impact on historically underinvested, low-resource communities and communities of color, and their effects can last for generations.</p><p><img src=""/Files/Admin/DCED%2D%281%29.jpg"" /><br /> While industry refuses to calculate the health care costs of toxic emissions or place a monetary value on clean water and open space, we know that it is necessary. We live in a culture that looks to the market for solutions to all kinds of problems. If we do not calculate the value or cost of something, the market cannot offer a solution, and government policy cannot appropriately fund programs that address, mitigate, or disincentivize harm.</p><p>PennFuture's new report, <a href=""/Files/Admin/PF%5FDCED%5FReport%5F5.pdf"">Economic Policy <em>is</em>Environmental Policy</a>,engages with these issues, initiating a dialogue about the confluence of economic development and environmental impacts. This report offers information for Pennsylvania policy leaders during rapid technological and environmental change. It also rebuts the false narrative that a healthy environment precludes a robust economy and that continued dependence on fossil fuels will give rise to a stable and prosperous future for Pennsylvanians.</p><p><img src=""/Files/Admin/ShellCracker.jpg"" /></p><p>The combination of fossil fuel-centered economic policies and weak environmental regulations has resulted in an economy that depends on dirty, finite energy resources, making it vulnerable to economic volatility. Most recently, Pennsylvanias economic development policies led to the construction of a new ethane cracker plant. However, the plant <a href=""https://ohiorivervalleyinstitute.org/wp-content/uploads/2024/01/Pennsylvanias-Bad-Bet-FINAL.pdf"">fails to deliver</a> on the number of jobs promised and <a href=""https://www.wesa.fm/environment-energy/2024-04-22/attorney-general-shell-whistleblower-pipeline-spills?utm_source=WESA&utm_campaign=087ba0c34e-inboxedition_COPY_01&utm_medium=email&utm_term=0_-5e22383ecb-%5BLIST_EMAIL_ID%5D"">consistently violates its permits</a>, releasing toxic pollutants into the air. If Pennsylvania continues to rely on the fossil fuel industries that dominated the last two centuries, our workers and our communities will be left behind. We will continue to leave behind a legacy of degraded air, water, and land.</p><p><img src=""/Files/Admin/Montour%2DPower%2DPlant.jpg"" /></p><p>This is because market forces are shifting, causing fossil fuels like coal and fracked gas to be in decline; and yet new opportunities abound. Fellow industrial states, like Ohio, West Virginia, and even Texas and Wyoming, are pivoting their economies in a different direction - toward renewable energy and <a href=""https://www.wsaz.com/2023/06/20/battery-manufacturing-plant-coming-ohio/"">cleantech manufacturing</a>. They are proactively investing in high-growth industries to strengthen and stabilize their economies against the volatility and decline of fossil fuels. While these states are not driven by the goal of environmental protection, these economic policy choices will result in better environmental outcomes.</p><p>The writing is on the wall: Forward-thinking economic development policy can transform Pennsylvania back into a leader in both the manufacturing and energy sectors. Decision-makers need to capitalize on high-growth industries that both decarbonize and diversify the economy, like battery manufacturing, energy efficiency, and the deployment of renewables. In the face of national economic and technological changes, stabilizing and modernizing Pennsylvanias economy must be paramount -for the sake of our workers and the climate.<br /> The Department of Community and Economic Development (DCED) plays a crucial role in shaping Pennsylvanias economy. Our report delves into the organizations structure, administration, and importance, highlighting its key role in driving economic development policy for the state. Despite being unfamiliar to many, the DCED is pivotal in setting and facilitating the agenda for the states long-term economic development. As we move towards a decarbonized economy, it is essential for the DCED to proactively engage with the current landscape, ensuring that all communities, especially vulnerable ones, are included in this necessary economic transition.</p><p>As we point out in the report, there are concrete steps that can be taken to move the needle on this economic and environmental project. First, to take advantage of its strengths, the DCED must be reformed and its resources redirected toward industries that support the future of our workforce, communities, and public health, with an eye towards our environment and the most vulnerable Pennsylvanians. Establishing Climate Accountability Measures within its funding structure for program priorities and reshaping Pennsylvanias Energy Economy program would provide the necessary structure to prioritize clean energy investments and decarbonization efforts.</p><p><img src=""/Files/Admin/Bradford.jpg"" /><img src=""/Files/Admin/Susquehanna.jpg"" /></p><p>Second, the DCED must leverage its private sector influence through its strategic collaborations with public and private partnerships to facilitate Pennsylvanias transition to a modern and equitable economy, via an aggressive sector-based climate strategy. Pushing to reform Team PA (a private, 501(c)(3) organization tasked with <a href=""https://teampa.com/wp-content/uploads/2023/06/Team-PA-Executive-Order-2023.pdf"">""increasing job growth, retention, and creation""</a>) as a champion for Pennsylvanias transition to a decarbonized and diversified economy is the first step, beginning with the intentional inclusion of environmental groups on its private sector board of directors. Subsequently, to bolster Team PAs new mission, the state must create an interagency Clean Energy Working Group, which would develop a comprehensive plan that supports environmental justice and energy communities through the strategic deployment of decarbonization, energy efficiency, and renewable energy resources and infrastructure in the Commonwealth of Pennsylvania. These changes will set Pennsylvania on a path toward establishing a stable economy that can sustain workers, communities, and the environment.</p><p>Declining fossil fuel markets and the impacts of the severe weather generated by our changing climate are driving decarbonization efforts across the country, and we are now seeing the creation of the necessary economic tools to fund them. Continued dependence on fossil fuels is an outdated economic game plan that will destabilize Pennsylvanias economy and perpetuate environmental and community degradation and injustice. A forward-thinking economic policy that prioritizes the decarbonization and renewable energy sectors can provide long-term certainty for industry and labor in a political climate that breeds instability through battles over environmental policy. We know how to get there and DCED is the key.</p><p><img src=""/Files/Admin/DCED%2DReport%2D2024.jpg"" /></p><p>Read the full <strong><em>Economic Policy is Environmental Policy</em></strong> report <a href=""/Files/Admin/PF%5FDCED%5FReport%5F5.pdf"">here</a>.</p><p>Over the next few months, well bring you new information on our sustainable economic development work. The next blog in the series will take a step back and explain what we mean when we say ""Sustainable Economy"".</p><p><br /><em>PennFuture is ramping up our efforts to connect economic development to environmental issues to promote a healthy economy, healthy communities, and a healthy environment. If you'd like to support our efforts on sustainable economic development in Pennsylvania, please consider <a href=""http://www.pennfuture.org/donate"">becoming a member today</a>. Your support is what makes reports like this possible.</em></p>",Community; Energy; Environment,"Donna Kohut, Policy Manager for Sustainable Economics",,
Summer 2024 Legal Interns,6/6/2024,"<p>Since its inception in 1998, PennFuture has emphasized the importance of using the law to protect Pennsylvania's environment and ""create a just future where nature, communities, and the economy thrive.""</p><p>Over the past two decades, we have achieved significant legal and policy victories that reduce pollution and protect the environment and our communities. We have provided millions of dollars in pro bono legal services while setting critical precedents and enforcing environmental laws across the Commonwealth.<br /> But as PennFuture looks forward to the next 20 years, we recognize that we need to be more involved with cultivating the people that will continue to support our mission. Our staff have a long history of mentoring interns, externs, and fellows, and we wanted to create a more formal program to inspire the next generation.<br /> With the generous support of the George and Miriam Martin Foundation and the Otto Haas Charitable Trust, PennFuture created a paid legal internship program to inspire and mentor students interested in making a difference for our environment.</p><p>Ultimately, the goal of this program is to provide the organization a cadre of young legal and policy minds interested in taking on the myriad challenges impacting Pennsylvania as well as to further their potential environmental careers. We've seen success on this front as many of our legal interns have found work in the Pennsylvania environmental legal space. We also hope that providing for a funded internship will help to bring more diversity and inclusivity into the non-profit environmental advocacy sphere.<br /> Over the past four years, our interns have made it possible for PennFuture's legal team to do more, faster, and better! They have supported our litigation efforts against water polluters and fracked-gas facilities, they have drafted comments in support of stronger regulatory protections across the Commonwealth, and they have helped our attorneys strategize and execute impactful legal actions. We are grateful for all of the hard work, passion, and dedication of our legal interns.<br /> This summer, we have three fantastic students for our internship, representing a range of backgrounds and experiences. We've asked our new interns to explain, in their own words, what environmental law and PennFuture's mission means to them:</p><p><img src=""/Files/Admin/Headshot.jpg"" /></p><p><strong>Andriana Vega, rising Third Year student at Penn State Dickinson Law</strong><br /> Growing up in the Midwest around factory farming piqued my interest in environmental law. While farming is crucial to sustaining our population, the effects factory farming has on communities and the environment are devastating. The work done at PennFuture is precisely the reason I chose to become an attorney: to help move towards more sustainable practices in all industries, not just farming.<br /> I am most excited about learning from the experienced individuals at PennFuture and being able to contribute to projects that actually make a difference in the fight to preserve the environment. Climate change may not happen overnight, but it's the little victories that will tilt the needle.<br /> While at Penn State Dickinson Law I have remained actively involved in the community, serving as President of the school's Animal Legal Defense Fund; Vice President of Environmental Law Society; Co-founder, Treasurer and Vice President of the school's multicultural dance organization, The Moving Party; Treasurer of Hearsay Acapella Group; Chair of the Wellness Committee; and member of Phi Alpha Delta and the Latin Law Students Association.</p><p><img src=""/Files/Admin/headshot%2DNYILR.png"" /></p><p><strong>Jessie Staley, rising Third Year student at St. John's University School of Law</strong><br /> Environmentalism has been a passion in my personal life for many years, but I had not considered it as a future career until I started law school. As a rising third year law student at St. Johns Law in New York, I am looking forward to a career in international environmental law.<br /> I completed my BA in Political Science and International Studies, with a focus in Peace Studies, at the University of Missouri. There, I gained an interest in civil armed conflicts and found that many start and persist due to environmental stressors, such as oil and/or food insecurity. I came to law school with the hopes of learning more about International Humanitarian Law and the legal frameworks for the intergovernmental organizations who lead international peace work, like the United Nations. While taking my first year courses, like Property Law, I found more intersections between the environment and conflict. I discovered my niche career path in International Water Law, addressing water scarcity as a strategy for peace work.<br /> I am very excited to work with PennFuture this summer to learn more about the nonprofit space and localized legal advocacy. With their Clean Water initiative, I have many opportunities to learn more about water law and various strategies to advocate for water access and quality. I hope to continue learning about environmental law and to learn new ways to be a better environmental lawyer from PennFuture's holistic advocacy approach.</p><p><img src=""/Files/Admin/20200905%5F184832.jpg"" /></p><p><strong>Jasmine Gunning, rising Third Year student at Penn State Law</strong><br /> I am currently a J.D. candidate at Penn State Law (25) at University Park, PA. At Penn State Law, I have the pleasure of serving as Fellowship Chair for the Criminal Law Society, Outreach Coordinator for the Human Rights Society, and Secretary for the Immigration Law Society. Coming into law school, I wasn't quite sure what kind of law I wanted to practice, but I knew I wanted two things: to feel as if I'm making a difference, and to help others in some way. Environmental law checks both of those boxes for me.<br /> Growing up in rural South Carolina, I've always had great respect for our environment and all of the things it provides us with - food, water, recreation, and the space to just be. Over the years I've watched my home state develop and grow tremendously. This extreme growth has taught me a lot about the importance of both sustainability and conservation, as well as the interplay between the two, especially in marginalized communities. Wanting to ensure that those two concepts stay at the forefront of development and progress is what led me to environmental law, and more particularly, energy law.<br /> Over the past semester, I had the opportunity to work as a research assistant in the shale division of the Penn State Law Center for Agriculture and Shale Law. That experience gave me the opportunity to study the specifics of the oil and gas industry, as well as how policymaking affects the industry, and vice versa. I am excited to apply this knowledge to my time here at PennFuture this summer, while also learning more about other areas of environmental law and policy. PennFuture's commitment to environmental advocacy is what drew me to this organization and I'm so honored to be part of the team!</p>",Environment,"Abigail M. Jones, Vice President of Legal and Policy",,
